"No.","Time","Source","Destination","Protocol","Length","Info"
"1","0.000000","172.16.44.208","35.174.127.31","TCP","54","59854  >  443 [ACK] Seq=1 Ack=1 Win=253 Len=0"
"2","0.088436","40.99.34.242","172.16.44.208","TLSv1.2","483","Application Data, Application Data, Application Data"
"3","0.088502","172.16.44.208","40.99.34.242","TCP","54","61296  >  443 [ACK] Seq=1 Ack=430 Win=1019 Len=0"
"4","0.104479","172.16.44.208","40.99.34.242","TLSv1.2","288","Application Data"
"5","0.104787","52.182.143.213","172.16.44.208","TCP","66","443  >  61298 [SYN, ACK] Seq=0 Ack=1 Win=65535 Len=0 MSS=1440 WS=256 SACK_PERM"
"6","0.104872","172.16.44.208","52.182.143.213","TCP","54","61298  >  443 [ACK] Seq=1 Ack=1 Win=1024 Len=0"
"7","0.106244","172.16.44.208","52.182.143.213","TLSv1.3","536","Client Hello (SNI=server.events.data.microsoft.com)"
"8","0.180770","40.99.34.242","172.16.44.208","TCP","60","443  >  61296 [ACK] Seq=430 Ack=235 Win=250 Len=0"
"9","0.180770","52.182.143.213","172.16.44.208","TCP","60","443  >  61298 [ACK] Seq=1 Ack=483 Win=65280 Len=0"
"10","0.180770","52.182.143.213","172.16.44.208","TCP","60","[TCP Dup ACK 9#1] 443  >  61298 [ACK] Seq=1 Ack=483 Win=65280 Len=0"
"11","0.428604","52.182.143.213","172.16.44.208","TLSv1.3","5894","Server Hello, Change Cipher Spec"
"12","0.428604","52.182.143.213","172.16.44.208","TLSv1.3","626","Application Data"
"13","0.428604","142.250.182.138","172.16.44.208","TLSv1.2","127","Application Data"
"14","0.428720","172.16.44.208","52.182.143.213","TCP","54","61298  >  443 [ACK] Seq=483 Ack=6413 Win=1024 Len=0"
"15","0.428966","172.16.44.208","142.250.182.138","TCP","54","61149  >  443 [FIN, ACK] Seq=1 Ack=74 Win=255 Len=0"
"16","0.435436","142.250.182.138","172.16.44.208","TCP","60","443  >  61149 [FIN, ACK] Seq=74 Ack=2 Win=219 Len=0"
"17","0.435496","172.16.44.208","142.250.182.138","TCP","54","61149  >  443 [ACK] Seq=2 Ack=75 Win=255 Len=0"
"18","0.436272","172.16.44.208","52.182.143.213","TLSv1.3","134","Change Cipher Spec, Application Data"
"19","0.436723","172.16.44.208","52.182.143.213","TLSv1.3","134","Application Data"
"20","0.436962","172.16.44.208","52.182.143.213","TLSv1.3","350","Application Data"
"21","0.437258","172.16.44.208","52.182.143.213","TLSv1.3","1429","Application Data"
"22","0.437354","172.16.44.208","52.182.143.213","TLSv1.3","85","Application Data"
"23","0.446435","52.182.143.213","172.16.44.208","TCP","60","443  >  61298 [ACK] Seq=6413 Ack=563 Win=65280 Len=0"
"24","0.446435","52.182.143.213","172.16.44.208","TCP","60","443  >  61298 [ACK] Seq=6413 Ack=643 Win=65280 Len=0"
"25","0.446435","52.182.143.213","172.16.44.208","TCP","60","443  >  61298 [ACK] Seq=6413 Ack=939 Win=65024 Len=0"
"26","0.446435","52.182.143.213","172.16.44.208","TCP","60","443  >  61298 [ACK] Seq=6413 Ack=2314 Win=63744 Len=0"
"27","0.446435","52.182.143.213","172.16.44.208","TCP","60","443  >  61298 [ACK] Seq=6413 Ack=2345 Win=63744 Len=0"
"28","0.478206","172.16.44.208","172.16.1.11","DNS","82","Standard query 0x113d A t-ring-fdv2.msedge.net"
"29","0.503157","142.251.221.170","172.16.44.208","TLSv1.2","127","Application Data"
"30","0.503157","142.250.196.174","172.16.44.208","TLSv1.2","127","Application Data"
"31","0.503157","142.250.206.14","172.16.44.208","TLSv1.2","127","Application Data"
"32","0.503448","172.16.44.208","142.251.221.170","TCP","54","61131  >  443 [FIN, ACK] Seq=1 Ack=74 Win=255 Len=0"
"33","0.503557","172.16.44.208","142.250.206.14","TCP","54","61121  >  443 [FIN, ACK] Seq=1 Ack=74 Win=255 Len=0"
"34","0.503628","172.16.44.208","142.250.196.174","TCP","54","61108  >  443 [FIN, ACK] Seq=1 Ack=74 Win=253 Len=0"
"35","0.504864","40.99.34.242","172.16.44.208","TLSv1.2","246","Application Data"
"36","0.504891","172.16.44.208","40.99.34.242","TCP","54","61296  >  443 [ACK] Seq=235 Ack=622 Win=1018 Len=0"
"37","0.508824","142.251.221.170","172.16.44.208","TCP","60","443  >  61131 [FIN, ACK] Seq=74 Ack=2 Win=300 Len=0"
"38","0.508824","142.250.206.14","172.16.44.208","TCP","60","443  >  61121 [FIN, ACK] Seq=74 Ack=2 Win=631 Len=0"
"39","0.508824","142.250.196.174","172.16.44.208","TCP","60","443  >  61108 [FIN, ACK] Seq=74 Ack=2 Win=631 Len=0"
"40","0.508824","40.99.34.242","172.16.44.208","TLSv1.2","311","Application Data, Application Data"
"41","0.508868","172.16.44.208","142.251.221.170","TCP","54","61131  >  443 [ACK] Seq=2 Ack=75 Win=255 Len=0"
"42","0.508901","172.16.44.208","142.250.206.14","TCP","54","61121  >  443 [ACK] Seq=2 Ack=75 Win=255 Len=0"
"43","0.508921","172.16.44.208","142.250.196.174","TCP","54","61108  >  443 [ACK] Seq=2 Ack=75 Win=253 Len=0"
"44","0.508953","172.16.44.208","40.99.34.242","TCP","54","61296  >  443 [ACK] Seq=235 Ack=879 Win=1024 Len=0"
"45","0.561203","172.16.44.208","40.99.34.242","TLSv1.2","456","Application Data"
"46","0.561590","172.16.44.208","40.99.34.242","TCP","1514","61296  >  443 [ACK] Seq=637 Ack=879 Win=1024 Len=1460 [TCP PDU reassembled in 47]"
"47","0.561590","172.16.44.208","40.99.34.242","TLSv1.2","358","Application Data"
"48","0.561686","172.16.44.208","40.99.34.242","TLSv1.2","463","Application Data"
"49","0.580968","142.251.221.206","172.16.44.208","TLSv1.2","127","Application Data"
"50","0.580968","40.99.34.242","172.16.44.208","TCP","60","443  >  61296 [ACK] Seq=879 Ack=637 Win=249 Len=0"
"51","0.580968","40.99.34.242","172.16.44.208","TCP","60","443  >  61296 [ACK] Seq=879 Ack=2097 Win=244 Len=0"
"52","0.580968","40.99.34.242","172.16.44.208","TCP","60","443  >  61296 [ACK] Seq=879 Ack=2401 Win=243 Len=0"
"53","0.580968","40.99.34.242","172.16.44.208","TCP","60","443  >  61296 [ACK] Seq=879 Ack=2810 Win=242 Len=0"
"54","0.581327","172.16.44.208","142.251.221.206","TCP","54","61155  >  443 [FIN, ACK] Seq=1 Ack=74 Win=510 Len=0"
"55","0.586807","142.251.221.206","172.16.44.208","TCP","60","443  >  61155 [FIN, ACK] Seq=74 Ack=2 Win=631 Len=0"
"56","0.586841","172.16.44.208","142.251.221.206","TCP","54","61155  >  443 [ACK] Seq=2 Ack=75 Win=510 Len=0"
"57","0.599378","5e:ff:63:53:14:fb","Broadcast","ARP","56","Who has 172.16.44.1? Tell 172.16.45.219"
"58","0.599396","172.16.44.192","255.255.255.255","DHCP","364","DHCP Request  - Transaction ID 0xab682a36"
"59","0.732021","142.250.195.110","172.16.44.208","TLSv1.2","127","Application Data"
"60","0.732021","52.182.143.213","172.16.44.208","TLSv1.3","157","Application Data"
"61","0.732114","172.16.44.208","52.182.143.213","TCP","54","61298  >  443 [ACK] Seq=2345 Ack=6516 Win=1023 Len=0"
"62","0.732274","172.16.44.208","142.250.195.110","TCP","54","61139  >  443 [FIN, ACK] Seq=1 Ack=74 Win=254 Len=0"
"63","0.737390","52.182.143.213","172.16.44.208","TLSv1.3","116","Application Data"
"64","0.737390","142.250.195.110","172.16.44.208","TCP","60","443  >  61139 [FIN, ACK] Seq=74 Ack=2 Win=631 Len=0"
"65","0.737446","172.16.44.208","142.250.195.110","TCP","54","61139  >  443 [ACK] Seq=2 Ack=75 Win=254 Len=0"
"66","0.737472","172.16.44.208","52.182.143.213","TCP","54","61298  >  443 [ACK] Seq=2345 Ack=6578 Win=1023 Len=0"
"67","0.737505","172.16.44.208","52.182.143.213","TLSv1.3","85","Application Data"
"68","0.742220","52.182.143.213","172.16.44.208","TCP","60","443  >  61298 [ACK] Seq=6578 Ack=2376 Win=63744 Len=0"
"69","0.804703","Intel_5c:93:10","Broadcast","ARP","60","Who has 172.16.44.120? (ARP Probe)"
"70","0.804730","fe80::28ff:1129:b86:fc95","ff02::1","ICMPv6","86","Neighbor Advertisement fe80::28ff:1129:b86:fc95 (ovr) is at 10:3d:1c:5c:93:10"
"71","0.809102","157.240.192.55","172.16.44.208","SSL","107","Continuation Data"
"72","0.858559","172.16.44.208","157.240.192.55","TCP","54","60332  >  443 [ACK] Seq=1 Ack=54 Win=508 Len=0"
"73","0.882541","40.99.34.242","172.16.44.208","TLSv1.2","240","Application Data"
"74","0.882541","40.99.34.242","172.16.44.208","TLSv1.2","1514","Application Data, Application Data, Application Data, Application Data, Application Data, Application Data"
"75","0.882606","172.16.44.208","40.99.34.242","TCP","54","61296  >  443 [ACK] Seq=2810 Ack=2525 Win=1024 Len=0"
"76","0.887398","40.99.34.242","172.16.44.208","TLSv1.2","376","Application Data, Application Data"
"77","0.887467","172.16.44.208","40.99.34.242","TCP","54","61296  >  443 [ACK] Seq=2810 Ack=2847 Win=1022 Len=0"
"78","0.960595","52.182.143.213","172.16.44.208","TLSv1.3","85","Application Data"
"79","0.960663","172.16.44.208","52.182.143.213","TCP","54","61298  >  443 [ACK] Seq=2376 Ack=6609 Win=1023 Len=0"
"80","0.972388","52.182.143.213","172.16.44.208","TLSv1.3","332","Application Data"
"81","0.972451","172.16.44.208","52.182.143.213","TCP","54","61298  >  443 [ACK] Seq=2376 Ack=6887 Win=1022 Len=0"
"82","0.972677","172.16.44.208","52.182.143.213","TLSv1.3","127","Application Data"
"83","0.973004","172.16.44.208","52.182.143.213","TLSv1.3","1338","Application Data"
"84","0.973095","172.16.44.208","52.182.143.213","TLSv1.3","85","Application Data"
"85","0.977247","52.182.143.213","172.16.44.208","TCP","60","443  >  61298 [ACK] Seq=6887 Ack=2449 Win=63744 Len=0"
"86","0.977247","52.182.143.213","172.16.44.208","TCP","60","443  >  61298 [ACK] Seq=6887 Ack=3733 Win=62464 Len=0"
"87","0.977247","52.182.143.213","172.16.44.208","TCP","60","443  >  61298 [ACK] Seq=6887 Ack=3764 Win=62464 Len=0"
"88","1.055454","172.16.44.208","23.57.75.8","TCP","1438","61269  >  443 [ACK] Seq=1 Ack=1 Win=1019 Len=1384 [TCP PDU reassembled in 90]"
"89","1.055454","172.16.44.208","23.57.75.8","TCP","1438","61269  >  443 [ACK] Seq=1385 Ack=1 Win=1019 Len=1384 [TCP PDU reassembled in 90]"
"90","1.055454","172.16.44.208","23.57.75.8","TLSv1.2","452","Application Data"
"91","1.055586","172.16.44.208","23.57.75.8","TCP","1438","61269  >  443 [ACK] Seq=3167 Ack=1 Win=1019 Len=1384 [TCP PDU reassembled in 93]"
"92","1.055586","172.16.44.208","23.57.75.8","TCP","1438","61269  >  443 [ACK] Seq=4551 Ack=1 Win=1019 Len=1384 [TCP PDU reassembled in 93]"
"93","1.055586","172.16.44.208","23.57.75.8","TLSv1.2","1229","Application Data"
"94","1.055666","172.16.44.208","23.57.75.8","TLSv1.2","85","Application Data"
"95","1.081254","172.16.44.208","23.57.75.8","TCP","1438","[TCP Retransmission] 61269  >  443 [PSH, ACK] Seq=5757 Ack=1 Win=1019 Len=1384"
"96","1.115995","23.57.75.8","172.16.44.208","TCP","60","443  >  61269 [ACK] Seq=1 Ack=1385 Win=1263 Len=0"
"97","1.115995","23.57.75.8","172.16.44.208","TCP","60","443  >  61269 [ACK] Seq=1 Ack=2769 Win=1261 Len=0"
"98","1.115995","23.57.75.8","172.16.44.208","TCP","60","443  >  61269 [ACK] Seq=1 Ack=3167 Win=1258 Len=0"
"99","1.115995","23.57.75.8","172.16.44.208","TCP","60","443  >  61269 [ACK] Seq=1 Ack=4551 Win=1248 Len=0"
"100","1.115995","23.57.75.8","172.16.44.208","TCP","60","443  >  61269 [ACK] Seq=1 Ack=5935 Win=1261 Len=0"
"101","1.115995","23.57.75.8","172.16.44.208","TCP","60","443  >  61269 [ACK] Seq=1 Ack=7110 Win=1252 Len=0"
"102","1.115995","23.57.75.8","172.16.44.208","TCP","60","443  >  61269 [ACK] Seq=1 Ack=7141 Win=1252 Len=0"
"103","1.115995","23.57.75.8","172.16.44.208","TCP","66","[TCP Dup ACK 102#1] 443  >  61269 [ACK] Seq=1 Ack=7141 Win=1252 Len=0 SLE=5757 SRE=7141"
"104","1.271778","23.57.75.8","172.16.44.208","TLSv1.2","504","Application Data, Application Data"
"105","1.271862","172.16.44.208","23.57.75.8","TCP","54","61269  >  443 [ACK] Seq=7141 Ack=451 Win=1024 Len=0"
"106","1.507174","52.182.143.213","172.16.44.208","TLSv1.3","153","Application Data"
"107","1.507237","172.16.44.208","52.182.143.213","TCP","54","61298  >  443 [ACK] Seq=3764 Ack=6986 Win=1021 Len=0"
"108","2.019074","172.16.44.208","172.16.1.11","DNS","74","Standard query 0x02fd A assets.msn.com"
"109","2.025766","172.16.1.11","172.16.44.208","DNS","291","Standard query response 0x02fd A assets.msn.com CNAME assets.msn.com.edgesuite.net CNAME a233.dscd.akamai.net A 23.34.81.16 A 23.34.81.11 A 23.34.81.35 A 23.34.81.9 A 23.34.81.34 A 23.34.81.26 A 23.34.81.32 A 23.34.81.27 A 23.34.81.8"
"110","2.026644","172.16.44.208","23.34.81.16","TCP","66","61299  >  443 [SYN] Seq=0 Win=65535 Len=0 MSS=1460 WS=256 SACK_PERM"
"111","2.033945","23.34.81.16","172.16.44.208","TCP","66","443  >  61299 [SYN, ACK] Seq=0 Ack=1 Win=64240 Len=0 MSS=1384 SACK_PERM WS=128"
"112","2.034036","172.16.44.208","23.34.81.16","TCP","54","61299  >  443 [ACK] Seq=1 Ack=1 Win=262144 Len=0"
"113","2.036334","172.16.44.208","23.34.81.16","TLSv1.3","821","Client Hello (SNI=assets.msn.com)"
"114","2.041865","23.34.81.16","172.16.44.208","TCP","60","443  >  61299 [ACK] Seq=1 Ack=768 Win=63488 Len=0"
"115","2.051088","23.34.81.16","172.16.44.208","TLSv1.3","318","Server Hello, Change Cipher Spec, Application Data, Application Data"
"116","2.051157","172.16.44.208","23.34.81.16","TCP","54","61299  >  443 [ACK] Seq=768 Ack=265 Win=261632 Len=0"
"117","2.061807","172.16.44.208","23.34.81.16","TLSv1.3","134","Change Cipher Spec, Application Data"
"118","2.062025","172.16.44.208","23.34.81.16","TLSv1.3","134","Application Data"
"119","2.064388","172.16.44.208","23.34.81.16","TCP","1438","61299  >  443 [ACK] Seq=928 Ack=265 Win=261632 Len=1384 [TCP PDU reassembled in 120]"
"120","2.064388","172.16.44.208","23.34.81.16","TLSv1.3","413","Application Data"
"121","2.067811","23.34.81.16","172.16.44.208","TCP","60","443  >  61299 [ACK] Seq=265 Ack=928 Win=63360 Len=0"
"122","2.070099","23.34.81.16","172.16.44.208","TCP","60","443  >  61299 [ACK] Seq=265 Ack=2671 Win=61696 Len=0"
"123","2.070099","23.34.81.16","172.16.44.208","TLSv1.3","341","Application Data"
"124","2.070137","172.16.44.208","23.34.81.16","TCP","54","61299  >  443 [ACK] Seq=2671 Ack=552 Win=261376 Len=0"
"125","2.074621","23.34.81.16","172.16.44.208","TLSv1.3","146","Application Data, Application Data"
"126","2.074656","172.16.44.208","23.34.81.16","TCP","54","61299  >  443 [ACK] Seq=2671 Ack=644 Win=261376 Len=0"
"127","2.074762","172.16.44.208","23.34.81.16","TLSv1.3","85","Application Data"
"128","2.115406","23.34.81.16","172.16.44.208","TCP","60","443  >  61299 [ACK] Seq=644 Ack=2702 Win=61696 Len=0"
"129","2.135643","Intel_80:92:10","Broadcast","ARP","56","Who has 172.16.44.1? Tell 172.16.45.118"
"130","2.135688","Intel_4d:ce:75","Broadcast","ARP","42","Who has 172.16.44.1? Tell 172.16.45.196"
"131","2.750138","Intel_5c:93:10","Broadcast","ARP","60","ARP Announcement for 172.16.44.120"
"132","2.791232","23.34.81.16","172.16.44.208","TCP","1514","443  >  61299 [ACK] Seq=644 Ack=2702 Win=61696 Len=1460 [TCP PDU reassembled in 133]"
"133","2.791232","23.34.81.16","172.16.44.208","TLSv1.3","1485","Application Data"
"134","2.791232","23.34.81.16","172.16.44.208","TCP","11734","443  >  61299 [ACK] Seq=3535 Ack=2702 Win=61696 Len=11680 [TCP PDU reassembled in 136]"
"135","2.791319","172.16.44.208","23.34.81.16","TCP","54","61299  >  443 [ACK] Seq=2702 Ack=15215 Win=262144 Len=0"
"136","2.796609","23.34.81.16","172.16.44.208","TLSv1.3","14654","Application Data, Application Data"
"137","2.796673","172.16.44.208","23.34.81.16","TCP","54","61299  >  443 [ACK] Seq=2702 Ack=29815 Win=262144 Len=0"
"138","2.801613","23.34.81.16","172.16.44.208","TLSv1.3","14654","Application Data, Application Data, Application Data"
"139","2.801689","172.16.44.208","23.34.81.16","TCP","54","61299  >  443 [ACK] Seq=2702 Ack=44415 Win=262144 Len=0"
"140","2.807149","23.34.81.16","172.16.44.208","TLSv1.3","14654","Application Data, Application Data"
"141","2.807201","172.16.44.208","23.34.81.16","TCP","54","61299  >  443 [ACK] Seq=2702 Ack=59015 Win=262144 Len=0"
"142","2.813076","23.34.81.16","172.16.44.208","TCP","1514","443  >  61299 [ACK] Seq=59015 Ack=2702 Win=61696 Len=1460 [TCP PDU reassembled in 148]"
"143","2.813076","23.34.81.16","172.16.44.208","TCP","1514","443  >  61299 [ACK] Seq=60475 Ack=2702 Win=61696 Len=1460 [TCP PDU reassembled in 148]"
"144","2.813076","23.34.81.16","172.16.44.208","TCP","1514","443  >  61299 [ACK] Seq=61935 Ack=2702 Win=61696 Len=1460 [TCP PDU reassembled in 148]"
"145","2.813076","23.34.81.16","172.16.44.208","TCP","1514","443  >  61299 [ACK] Seq=63395 Ack=2702 Win=61696 Len=1460 [TCP PDU reassembled in 148]"
"146","2.813076","23.34.81.16","172.16.44.208","TCP","1514","443  >  61299 [ACK] Seq=64855 Ack=2702 Win=61696 Len=1460 [TCP PDU reassembled in 148]"
"147","2.813076","23.34.81.16","172.16.44.208","TCP","1514","443  >  61299 [ACK] Seq=66315 Ack=2702 Win=61696 Len=1460 [TCP PDU reassembled in 148]"
"148","2.813076","23.34.81.16","172.16.44.208","TLSv1.3","434","Application Data, Application Data"
"149","2.813153","172.16.44.208","23.34.81.16","TCP","54","61299  >  443 [ACK] Seq=2702 Ack=68155 Win=262144 Len=0"
"150","3.160499","CloudNetwork_19:a9:c1","Broadcast","ARP","56","Who has 172.16.44.139? Tell 172.16.45.194"
"151","3.304270","142.250.196.164","172.16.44.208","TLSv1.2","127","Application Data"
"152","3.304561","172.16.44.208","142.250.196.164","TCP","54","61110  >  443 [FIN, ACK] Seq=1 Ack=74 Win=254 Len=0"
"153","3.309343","142.250.196.164","172.16.44.208","TCP","60","443  >  61110 [FIN, ACK] Seq=74 Ack=2 Win=234 Len=0"
"154","3.309376","172.16.44.208","142.250.196.164","TCP","54","61110  >  443 [ACK] Seq=2 Ack=75 Win=254 Len=0"
"155","3.436457","172.16.44.208","13.107.6.254","TCP","66","61301  >  443 [SYN] Seq=0 Win=65535 Len=0 MSS=1460 WS=256 SACK_PERM"
"156","3.445120","13.107.6.254","172.16.44.208","TCP","66","443  >  61301 [SYN, ACK] Seq=0 Ack=1 Win=65535 Len=0 MSS=1440 WS=256 SACK_PERM"
"157","3.445284","172.16.44.208","13.107.6.254","TCP","54","61301  >  443 [ACK] Seq=1 Ack=1 Win=262144 Len=0"
"158","3.447907","172.16.44.208","13.107.6.254","TLSv1.3","972","Client Hello (SNI=b-ring.msedge.net)"
"159","3.453266","13.107.6.254","172.16.44.208","TCP","60","443  >  61301 [ACK] Seq=1 Ack=919 Win=64768 Len=0"
"160","3.458667","13.107.6.254","172.16.44.208","TLSv1.3","347","Server Hello, Change Cipher Spec, Application Data"
"161","3.458794","172.16.44.208","13.107.6.254","TCP","54","61301  >  443 [ACK] Seq=919 Ack=294 Win=261632 Len=0"
"162","3.463982","172.16.44.208","13.107.6.254","TLSv1.3","134","Change Cipher Spec, Application Data"
"163","3.464184","172.16.44.208","13.107.6.254","TLSv1.3","134","Application Data"
"164","3.464293","172.16.44.208","13.107.6.254","TLSv1.3","352","Application Data"
"165","3.469587","13.107.6.254","172.16.44.208","TCP","60","443  >  61301 [ACK] Seq=294 Ack=1377 Win=64512 Len=0"
"166","3.471958","13.107.6.254","172.16.44.208","TLSv1.3","116","Application Data"
"167","3.471992","172.16.44.208","13.107.6.254","TCP","54","61301  >  443 [ACK] Seq=1377 Ack=356 Win=261632 Len=0"
"168","3.472090","172.16.44.208","13.107.6.254","TLSv1.3","85","Application Data"
"169","3.477344","13.107.6.254","172.16.44.208","TLSv1.3","623","Application Data, Application Data, Application Data"
"170","3.477385","172.16.44.208","13.107.6.254","TCP","54","61301  >  443 [ACK] Seq=1408 Ack=925 Win=261120 Len=0"
"171","3.481736","172.16.44.208","13.107.6.254","TLSv1.3","129","Application Data"
"172","3.493925","13.107.6.254","172.16.44.208","TLSv1.3","248","Application Data"
"173","3.493980","172.16.44.208","13.107.6.254","TCP","54","61301  >  443 [ACK] Seq=1483 Ack=1119 Win=260864 Len=0"
"174","3.498193","172.16.44.208","204.79.197.222","TLSv1.2","614","Application Data"
"175","3.499120","13.107.6.254","172.16.44.208","TLSv1.3","85","Application Data"
"176","3.499170","172.16.44.208","13.107.6.254","TCP","54","61301  >  443 [ACK] Seq=1483 Ack=1150 Win=260864 Len=0"
"177","3.508789","204.79.197.222","172.16.44.208","TLSv1.2","231","Application Data"
"178","3.508910","172.16.44.208","204.79.197.222","TCP","54","61294  >  443 [ACK] Seq=561 Ack=178 Win=1023 Len=0"
"179","3.514748","204.79.197.222","172.16.44.208","TLSv1.2","85","Application Data"
"180","3.514794","172.16.44.208","204.79.197.222","TCP","54","61294  >  443 [ACK] Seq=561 Ack=209 Win=1023 Len=0"
"181","3.569800","02:d1:ea:6e:7f:95","Broadcast","ARP","60","Who has 172.16.44.1? Tell 172.16.44.253"
"182","3.876262","0.0.0.0","255.255.255.255","DHCP","352","DHCP Request  - Transaction ID 0xbf7535ea"
"183","3.876363","64:cf:0e:ab:4c:c2","Broadcast","ARP","56","Who has 172.16.44.1? Tell 172.16.44.122"
"184","3.979867","CloudNetwork_19:a9:c1","Broadcast","ARP","56","Who has 172.16.44.139? Tell 172.16.45.194"
"185","4.081747","64:cf:0e:ab:4c:c2","Broadcast","ARP","56","Who has 172.16.44.122? (ARP Probe)"
"186","4.081774","0.0.0.0","255.255.255.255","DHCP","364","DHCP Request  - Transaction ID 0xa6694723"
"187","4.388416","CloudNetwork_b7:4a:c5","Broadcast","ARP","56","Who has 172.16.44.1? Tell 172.16.45.167"
"188","4.486028","172.16.44.208","172.16.1.11","DNS","82","Standard query 0x113d A t-ring-fdv2.msedge.net"
"189","4.594089","2e:45:a6:53:d7:28","Broadcast","ARP","56","Who has 172.16.44.1? Tell 172.16.45.246"
"190","4.692664","172.16.44.208","23.57.75.8","TCP","54","60837  >  443 [RST, ACK] Seq=1 Ack=1 Win=0 Len=0"
"191","4.692947","172.16.44.208","204.79.197.222","TCP","54","60842  >  443 [RST, ACK] Seq=1 Ack=1 Win=0 Len=0"
"192","4.692949","172.16.44.208","13.107.4.254","TCP","54","60840  >  443 [RST, ACK] Seq=1 Ack=1 Win=0 Len=0"
"193","4.695880","Intel_e8:1d:90","Broadcast","ARP","42","Who has 172.16.44.1? Tell 172.16.46.36"
"194","4.695901","Intel_e8:1d:90","Broadcast","ARP","42","Who has 172.16.44.1? Tell 172.16.46.36"
"195","4.708417","172.16.44.208","13.107.246.58","TCP","54","60839  >  443 [RST, ACK] Seq=1 Ack=1 Win=0 Len=0"
"196","4.797719","Intel_5c:93:10","Broadcast","ARP","60","ARP Announcement for 172.16.44.120"
"197","4.900624","CloudNetwork_19:a9:c1","Broadcast","ARP","56","Who has 172.16.44.139? Tell 172.16.45.194"
"198","5.104800","64:cf:0e:ab:4c:c2","Broadcast","ARP","56","Who has 172.16.44.122? (ARP Probe)"
"199","5.104827","fe80::97ff:8059:21e4:bfe1","ff02::1","ICMPv6","86","Neighbor Advertisement fe80::97ff:8059:21e4:bfe1 (ovr) is at 64:cf:0e:ab:4c:c2"
"200","5.628942","172.16.1.11","172.16.44.208","DNS","124","Standard query response 0x113d A t-ring-fdv2.msedge.net CNAME t-ring.t-9999.fdv2-t-msedge.net"
"201","5.634918","172.16.44.208","172.16.1.11","DNS","82","Standard query 0xb84a A t-ring-fdv2.msedge.net"
"202","5.660503","172.16.44.208","8.8.8.8","DNS","82","Standard query 0xb84a A t-ring-fdv2.msedge.net"
"203","5.684865","8.8.8.8","172.16.44.208","DNS","82","Standard query response 0xb84a Server failure A t-ring-fdv2.msedge.net"
"204","5.685008","172.16.44.208","172.16.1.11","DNS","82","Standard query 0xb84a A t-ring-fdv2.msedge.net"
"205","5.720528","Intel_df:70:05","Broadcast","ARP","56","Who has 172.16.44.1? Tell 172.16.45.70"
"206","5.720552","CloudNetwork_b7:4a:c5","Broadcast","ARP","56","Who has 172.16.45.167? (ARP Probe)"
"207","5.821239","0.0.0.0","255.255.255.255","DHCP","352","DHCP Request  - Transaction ID 0xbf7535ea"
"208","6.129174","64:cf:0e:ab:4c:c2","Broadcast","ARP","56","Who has 172.16.44.122? (ARP Probe)"
"209","6.231984","CloudNetwork_19:a9:c1","Broadcast","ARP","56","Who has 172.16.44.139? Tell 172.16.45.194"
"210","6.640911","Intel_d3:4b:77","Broadcast","ARP","60","Who has 172.16.44.1? Tell 172.16.44.200"
"211","6.640948","0.0.0.0","255.255.255.255","DHCP","364","DHCP Request  - Transaction ID 0x9a77afad"
"212","6.743110","Intel_d3:4b:77","Broadcast","ARP","60","Who has 172.16.44.200? (ARP Probe)"
"213","6.948465","CloudNetwork_19:a9:c1","Broadcast","ARP","56","Who has 172.16.44.139? Tell 172.16.45.194"
"214","7.051340","CloudNetwork_b7:4a:c5","Broadcast","ARP","56","Who has 172.16.44.1? Tell 172.16.45.167"
"215","7.256598","64:cf:0e:ab:4c:c2","Broadcast","ARP","56","ARP Announcement for 172.16.44.122"
"216","7.357811","Intel_80:92:10","Broadcast","ARP","56","Who has 172.16.44.1? Tell 172.16.45.118"
"217","7.665591","Intel_bd:d4:09","Broadcast","ARP","56","Who has 172.16.44.1? Tell 172.16.44.131"
"218","7.689616","172.16.44.208","172.16.1.11","DNS","82","Standard query 0xb84a A t-ring-fdv2.msedge.net"
"219","7.769146","Intel_d3:4b:77","Broadcast","ARP","60","Who has 172.16.44.200? (ARP Probe)"
"220","7.769173","fe80::8e76:2c78:cd2b:eb93","ff02::1","ICMPv6","86","Neighbor Advertisement fe80::8e76:2c78:cd2b:eb93 (ovr) is at d0:65:78:d3:4b:77"
"221","7.972591","CloudNetwork_19:a9:c1","Broadcast","ARP","56","Who has 172.16.44.139? Tell 172.16.45.194"
"222","8.023166","172.16.44.208","20.195.84.23","TLSv1.2","85","Application Data"
"223","8.028559","20.195.84.23","172.16.44.208","TCP","60","443  >  59618 [ACK] Seq=1 Ack=32 Win=474 Len=0"
"224","8.586814","CloudNetwork_b7:4a:c5","Broadcast","ARP","56","Who has 172.16.45.167? (ARP Probe)"
"225","8.791596","fe80::bd14:a805:ca4:20d6","ff02::1","ICMPv6","86","Neighbor Advertisement fe80::bd14:a805:ca4:20d6 (ovr) is at 10:b1:df:b7:4a:c5"
"226","8.791776","Intel_d3:4b:77","Broadcast","ARP","60","Who has 172.16.44.200? (ARP Probe)"
"227","8.997045","02:d1:ea:6e:7f:95","Broadcast","ARP","60","Who has 172.16.44.1? Tell 172.16.44.253"
"228","9.110416","64:cf:0e:ab:4c:c2","Broadcast","ARP","56","ARP Announcement for 172.16.44.122"
"229","9.304105","4e:51:98:a5:27:94","Broadcast","ARP","56","Who has 172.16.44.1? Tell 172.16.44.138"
"230","9.304134","0.0.0.0","255.255.255.255","DHCP","364","DHCP Request  - Transaction ID 0x9a77afad"
"231","9.713241","CloudNetwork_b7:4a:c5","Broadcast","ARP","56","Who has 172.16.45.167? (ARP Probe)"
"232","9.815899","Intel_d3:4b:77","Broadcast","ARP","60","ARP Announcement for 172.16.44.200"
"233","10.225452","CloudNetwork_19:a9:c1","Broadcast","ARP","56","Who has 172.16.44.139? Tell 172.16.45.194"
"234","10.326810","CloudNetwork_b7:4a:c5","Broadcast","ARP","56","ARP Announcement for 172.16.45.167"
"235","10.326838","CloudNetwork_b7:4a:c5","Broadcast","ARP","56","Who has 172.16.44.1? Tell 172.16.45.167"
"236","10.749746","157.240.192.55","172.16.44.208","SSL","469","Continuation Data"
"237","10.754388","172.16.44.208","157.240.192.55","SSL","121","Continuation Data"
"238","10.761237","157.240.192.55","172.16.44.208","TCP","60","443  >  60332 [ACK] Seq=469 Ack=68 Win=5153 Len=0"
"239","10.944573","CloudNetwork_19:a9:c1","Broadcast","ARP","56","Who has 172.16.44.139? Tell 172.16.45.194"
"240","11.351789","CloudNetwork_b7:4a:c5","Broadcast","ARP","56","ARP Announcement for 172.16.45.167"
"241","11.696242","172.16.44.208","172.16.1.11","DNS","82","Standard query 0xb84a A t-ring-fdv2.msedge.net"
"242","11.761946","Intel_d3:4b:77","Broadcast","ARP","60","ARP Announcement for 172.16.44.200"
"243","11.966295","CloudNetwork_19:a9:c1","Broadcast","ARP","56","Who has 172.16.44.139? Tell 172.16.45.194"
"244","12.090263","20.195.84.23","172.16.44.208","TLSv1.2","81","Application Data"
"245","12.142938","172.16.44.208","20.195.84.23","TCP","54","59618  >  443 [ACK] Seq=32 Ack=28 Win=254 Len=0"
"246","12.477272","Intel_4d:ce:75","Broadcast","ARP","42","Who has 172.16.44.1? Tell 172.16.45.196"
"247","12.887578","Intel_bd:d4:09","Broadcast","ARP","56","Who has 172.16.44.1? Tell 172.16.44.131"
"248","13.005483","172.16.44.208","23.57.75.8","TCP","1438","61269  >  443 [ACK] Seq=7141 Ack=451 Win=1024 Len=1384 [TCP PDU reassembled in 250]"
"249","13.005483","172.16.44.208","23.57.75.8","TCP","1438","61269  >  443 [ACK] Seq=8525 Ack=451 Win=1024 Len=1384 [TCP PDU reassembled in 250]"
"250","13.005483","172.16.44.208","23.57.75.8","TLSv1.2","354","Application Data"
"251","13.005626","172.16.44.208","23.57.75.8","TLSv1.2","1026","Application Data"
"252","13.005708","172.16.44.208","23.57.75.8","TLSv1.2","85","Application Data"
"253","13.010778","23.57.75.8","172.16.44.208","TCP","60","443  >  61269 [ACK] Seq=451 Ack=8525 Win=1263 Len=0"
"254","13.010778","23.57.75.8","172.16.44.208","TCP","60","443  >  61269 [ACK] Seq=451 Ack=9909 Win=1253 Len=0"
"255","13.010778","23.57.75.8","172.16.44.208","TCP","60","443  >  61269 [ACK] Seq=451 Ack=10209 Win=1251 Len=0"
"256","13.010778","23.57.75.8","172.16.44.208","TCP","60","443  >  61269 [ACK] Seq=451 Ack=11181 Win=1261 Len=0"
"257","13.010778","23.57.75.8","172.16.44.208","TCP","60","443  >  61269 [ACK] Seq=451 Ack=11212 Win=1261 Len=0"
"258","13.131026","23.57.75.8","172.16.44.208","TLSv1.2","476","Application Data"
"259","13.131094","172.16.44.208","23.57.75.8","TCP","54","61269  >  443 [ACK] Seq=11212 Ack=873 Win=1022 Len=0"
"260","13.136919","23.57.75.8","172.16.44.208","TLSv1.2","85","Application Data"
"261","13.136957","172.16.44.208","23.57.75.8","TCP","54","61269  >  443 [ACK] Seq=11212 Ack=904 Win=1022 Len=0"
"262","13.383755","157.240.192.55","172.16.44.208","SSL","107","Continuation Data"
"263","13.431771","172.16.44.208","157.240.192.55","TCP","54","60332  >  443 [ACK] Seq=68 Ack=522 Win=506 Len=0"
"264","13.799980","172.16.1.11","172.16.44.208","DNS","124","Standard query response 0xb84a A t-ring-fdv2.msedge.net CNAME t-ring.t-9999.fdv2-t-msedge.net"
"265","14.789801","140.82.114.25","172.16.44.208","TLSv1.2","79","Application Data"
"266","14.790081","172.16.44.208","140.82.114.25","TLSv1.2","83","Application Data"
"267","14.796377","140.82.114.25","172.16.44.208","TCP","60","443  >  61032 [ACK] Seq=26 Ack=30 Win=62 Len=0"
"268","14.833251","0.0.0.0","255.255.255.255","DHCP","364","DHCP Request  - Transaction ID 0xd7827dcc"
"269","14.833310","CloudNetwork_b7:4a:c5","Broadcast","ARP","42","Who has 172.16.44.1? Tell 172.16.45.167"
"270","15.346081","CloudNetwork_b7:4a:c5","Broadcast","ARP","42","Who has 172.16.45.167? (ARP Probe)"
"271","15.600400","172.16.44.208","35.174.127.31","TLSv1.2","294","Application Data"
"272","15.614967","35.174.127.31","172.16.44.208","TCP","60","443  >  59854 [ACK] Seq=1 Ack=241 Win=320 Len=0"
"273","15.867682","35.174.127.31","172.16.44.208","TLSv1.2","317","Application Data"
"274","15.917209","172.16.44.208","35.174.127.31","TCP","54","59854  >  443 [ACK] Seq=241 Ack=264 Win=252 Len=0"
"275","16.164993","CloudNetwork_b7:4a:c5","Broadcast","ARP","42","Who has 172.16.45.167? (ARP Probe)"
"276","16.165032","fe80::bd14:a805:ca4:20d6","ff02::1","ICMPv6","86","Neighbor Advertisement fe80::bd14:a805:ca4:20d6 (ovr) is at 10:b1:df:b7:4a:c5"
"277","17.187614","CloudNetwork_b7:4a:c5","Broadcast","ARP","42","Who has 172.16.45.167? (ARP Probe)"
"278","17.714526","157.240.192.55","172.16.44.208","SSL","107","Continuation Data"
"279","17.768071","172.16.44.208","157.240.192.55","TCP","54","60332  >  443 [ACK] Seq=68 Ack=575 Win=506 Len=0"
"280","18.007909","Intel_80:92:10","Broadcast","ARP","56","Who has 172.16.44.1? Tell 172.16.45.118"
"281","18.213576","CloudNetwork_b7:4a:c5","Broadcast","ARP","42","ARP Announcement for 172.16.45.167"
"282","18.213609","CloudNetwork_19:a9:c1","Broadcast","ARP","56","Who has 172.16.44.139? Tell 172.16.45.194"
"283","18.316496","CloudNetwork_b7:4a:c5","Broadcast","ARP","42","Who has 172.16.44.1? Tell 172.16.45.167"
"284","18.929555","CloudNetwork_19:a9:c1","Broadcast","ARP","56","Who has 172.16.44.139? Tell 172.16.45.194"
"285","18.932406","172.16.44.208","20.195.84.23","TLSv1.2","82","Application Data"
"286","18.938530","20.195.84.23","172.16.44.208","TCP","60","443  >  59618 [ACK] Seq=28 Ack=60 Win=474 Len=0"
"287","19.529652","157.240.192.55","172.16.44.208","SSL","107","Continuation Data"
"288","19.570975","172.16.44.208","157.240.192.55","TCP","54","60332  >  443 [ACK] Seq=68 Ack=628 Win=511 Len=0"
"289","19.954108","CloudNetwork_19:a9:c1","Broadcast","ARP","56","Who has 172.16.44.139? Tell 172.16.45.194"
"290","20.158352","CloudNetwork_b7:4a:c5","Broadcast","ARP","42","ARP Announcement for 172.16.45.167"
"291","20.160559","172.16.1.11","172.16.44.208","DNS","124","Standard query response 0xb84a A t-ring-fdv2.msedge.net CNAME t-ring.t-9999.fdv2-t-msedge.net"
"292","20.875103","6e:d1:d1:88:54:fb","Broadcast","ARP","56","Who has 172.16.44.1? Tell 172.16.44.51"
"293","23.230329","Intel_80:92:10","Broadcast","ARP","56","Who has 172.16.44.1? Tell 172.16.45.118"
"294","23.230357","Intel_bd:d4:09","Broadcast","ARP","56","Who has 172.16.44.1? Tell 172.16.44.131"
"295","23.411468","157.240.192.55","172.16.44.208","SSL","107","Continuation Data"
"296","23.463291","172.16.44.208","157.240.192.55","TCP","54","60332  >  443 [ACK] Seq=68 Ack=681 Win=511 Len=0"
"297","23.808110","157.240.192.55","172.16.44.208","SSL","107","Continuation Data"
"298","23.861572","172.16.44.208","157.240.192.55","TCP","54","60332  >  443 [ACK] Seq=68 Ack=734 Win=511 Len=0"
"299","24.021687","172.16.44.208","20.195.84.23","TLSv1.2","85","Application Data"
"300","24.026230","20.195.84.23","172.16.44.208","TCP","60","443  >  59618 [ACK] Seq=28 Ack=91 Win=474 Len=0"
"301","24.532585","172.16.44.208","157.240.192.55","SSL","79","Continuation Data"
"302","24.539349","157.240.192.55","172.16.44.208","TCP","60","443  >  60332 [ACK] Seq=734 Ack=93 Win=5153 Len=0"
"303","25.584522","Intel_df:5d:5e","Broadcast","ARP","56","Who has 172.16.44.1? Tell 172.16.44.172"
"304","26.254721","172.16.44.208","104.21.16.1","TCP","55","60582  >  443 [ACK] Seq=1 Ack=1 Win=255 Len=1"
"305","26.259601","104.21.16.1","172.16.44.208","TCP","66","443  >  60582 [ACK] Seq=1 Ack=2 Win=20 Len=0 SLE=1 SRE=2"
"306","26.478766","172.16.44.208","140.82.114.22","TCP","55","61186  >  443 [ACK] Seq=1 Ack=1 Win=255 Len=1"
"307","26.483756","140.82.114.22","172.16.44.208","TCP","66","443  >  61186 [ACK] Seq=1 Ack=2 Win=116 Len=0 SLE=1 SRE=2"
"308","28.079478","20.195.84.23","172.16.44.208","TLSv1.2","81","Application Data"
"309","28.122016","172.16.44.208","20.195.84.23","TCP","54","59618  >  443 [ACK] Seq=91 Ack=55 Win=254 Len=0"
"310","28.999068","172.16.44.208","20.189.173.7","TCP","55","61162  >  443 [ACK] Seq=1 Ack=1 Win=255 Len=1"
"311","29.016860","20.189.173.7","172.16.44.208","TCP","60","443  >  61162 [RST] Seq=1 Win=0 Len=0"
"312","29.317677","172.16.44.208","185.199.111.133","TCP","55","60635  >  443 [ACK] Seq=1 Ack=1 Win=1022 Len=1"
"313","29.322868","185.199.111.133","172.16.44.208","TCP","66","443  >  60635 [ACK] Seq=1 Ack=2 Win=121 Len=0 SLE=1 SRE=2"
"314","29.715856","172.16.44.208","185.199.110.133","TCP","55","61008  >  443 [ACK] Seq=1 Ack=1 Win=251 Len=1"
"315","29.720463","185.199.110.133","172.16.44.208","TCP","66","443  >  61008 [ACK] Seq=1 Ack=2 Win=125 Len=0 SLE=1 SRE=2"
"316","30.036030","172.16.44.208","185.199.110.133","TCP","55","61009  >  443 [ACK] Seq=1 Ack=1 Win=254 Len=1"
"317","30.041318","185.199.110.133","172.16.44.208","TCP","66","443  >  61009 [ACK] Seq=1 Ack=2 Win=125 Len=0 SLE=1 SRE=2"
"318","30.808482","Intel_df:5d:5e","Broadcast","ARP","56","Who has 172.16.44.1? Tell 172.16.44.172"
"319","31.603464","172.16.44.208","35.174.127.31","TLSv1.2","294","Application Data"
"320","31.608480","35.174.127.31","172.16.44.208","TCP","60","443  >  59854 [ACK] Seq=264 Ack=481 Win=320 Len=0"
"321","31.868279","35.174.127.31","172.16.44.208","TLSv1.2","319","Application Data"
"322","31.922705","172.16.44.208","35.174.127.31","TCP","54","59854  >  443 [ACK] Seq=481 Ack=529 Win=251 Len=0"
"323","31.942021","157.240.192.55","172.16.44.208","SSL","501","Continuation Data"
"324","31.946815","172.16.44.208","157.240.192.55","SSL","121","Continuation Data"
"325","31.953876","157.240.192.55","172.16.44.208","TCP","60","443  >  60332 [ACK] Seq=1181 Ack=160 Win=5153 Len=0"
"326","33.675939","0.0.0.0","255.255.255.255","DHCP","342","DHCP Request  - Transaction ID 0xdf88c0b8"
"327","33.883220","Apple_d2:dd:99","Broadcast","ARP","56","ARP Announcement for 172.16.45.232"
"328","33.883253","Apple_d2:dd:99","Broadcast","ARP","56","Who has 172.16.44.151? Tell 172.16.45.232"
"329","33.883262","Apple_d2:dd:99","Broadcast","ARP","56","Who has 172.16.44.114? Tell 172.16.45.232"
"330","33.883268","Apple_d2:dd:99","Broadcast","ARP","56","Who has 172.16.45.162? Tell 172.16.45.232"
"331","33.885360","Apple_d2:dd:99","Broadcast","ARP","56","Who has 172.16.44.238? Tell 172.16.45.232"
"332","33.885378","Apple_d2:dd:99","Broadcast","ARP","56","Who has 172.16.45.137? Tell 172.16.45.232"
"333","33.885386","Apple_d2:dd:99","Broadcast","ARP","56","Who has 172.16.45.40? Tell 172.16.45.232"
"334","33.885395","Apple_d2:dd:99","Broadcast","ARP","56","Who has 172.16.44.162? Tell 172.16.45.232"
"335","33.885402","Apple_d2:dd:99","Broadcast","ARP","56","Who has 172.16.44.1? Tell 172.16.45.232"
"336","34.031971","172.16.44.208","224.0.0.251","MDNS","198","Standard query response 0x0000 PTR MSI._dosvc._tcp.local SRV 0 0 7680 MSI.local TXT"
"337","34.032317","fe80::2056:36e2:a60f:5655","ff02::fb","MDNS","218","Standard query response 0x0000 PTR MSI._dosvc._tcp.local SRV 0 0 7680 MSI.local TXT"
"338","34.032704","172.16.44.208","224.0.0.251","MDNS","81","Standard query 0x0000 ANY MSI._dosvc._tcp.local, ""QM"" question"
"339","34.032859","fe80::2056:36e2:a60f:5655","ff02::fb","MDNS","101","Standard query 0x0000 ANY MSI._dosvc._tcp.local, ""QM"" question"
"340","34.287246","172.16.44.208","224.0.0.251","MDNS","81","Standard query 0x0000 ANY MSI._dosvc._tcp.local, ""QM"" question"
"341","34.287651","fe80::2056:36e2:a60f:5655","ff02::fb","MDNS","101","Standard query 0x0000 ANY MSI._dosvc._tcp.local, ""QM"" question"
"342","34.291062","Apple_d2:dd:99","Broadcast","ARP","56","Who has 172.16.44.1? Tell 172.16.45.232"
"343","34.541198","172.16.44.208","224.0.0.251","MDNS","81","Standard query 0x0000 ANY MSI._dosvc._tcp.local, ""QM"" question"
"344","34.541665","fe80::2056:36e2:a60f:5655","ff02::fb","MDNS","101","Standard query 0x0000 ANY MSI._dosvc._tcp.local, ""QM"" question"
"345","34.573222","157.240.192.55","172.16.44.208","SSL","373","Continuation Data"
"346","34.578724","172.16.44.208","157.240.192.55","SSL","122","Continuation Data"
"347","34.586984","157.240.192.55","172.16.44.208","TCP","60","443  >  60332 [ACK] Seq=1500 Ack=228 Win=5153 Len=0"
"348","34.796911","172.16.44.208","224.0.0.251","MDNS","251","Standard query response 0x0000 PTR, cache flush MSI._dosvc._tcp.local SRV, cache flush 0 0 7680 MSI.local TXT, cache flush A, cache flush 172.16.44.208 AAAA, cache flush fe80::2056:36e2:a60f:5655"
"349","34.797232","fe80::2056:36e2:a60f:5655","ff02::fb","MDNS","271","Standard query response 0x0000 PTR, cache flush MSI._dosvc._tcp.local SRV, cache flush 0 0 7680 MSI.local TXT, cache flush A, cache flush 172.16.44.208 AAAA, cache flush fe80::2056:36e2:a60f:5655"
"350","34.797425","172.16.44.208","224.0.0.251","MDNS","199","Standard query response 0x0000 SRV, cache flush 0 0 7680 MSI.local TXT, cache flush A, cache flush 172.16.44.208 AAAA, cache flush fe80::2056:36e2:a60f:5655"
"351","34.797654","fe80::2056:36e2:a60f:5655","ff02::fb","MDNS","219","Standard query response 0x0000 SRV, cache flush 0 0 7680 MSI.local TXT, cache flush A, cache flush 172.16.44.208 AAAA, cache flush fe80::2056:36e2:a60f:5655"
"352","34.802040","Apple_d2:dd:99","Broadcast","ARP","56","Who has 172.16.44.147? Tell 172.16.45.232"
"353","34.802061","Apple_d2:dd:99","Broadcast","ARP","56","Who has 172.16.44.238? Tell 172.16.45.232"
"354","34.804070","Apple_d2:dd:99","Broadcast","ARP","56","Who has 172.16.45.115? Tell 172.16.45.232"
"355","34.804080","Apple_d2:dd:99","Broadcast","ARP","56","Who has 172.16.45.162? Tell 172.16.45.232"
"356","34.804088","Apple_d2:dd:99","Broadcast","ARP","56","Who has 172.16.44.114? Tell 172.16.45.232"
"357","34.804096","Apple_d2:dd:99","Broadcast","ARP","56","Who has 172.16.44.151? Tell 172.16.45.232"
"358","34.806136","Apple_d2:dd:99","Broadcast","ARP","56","Who has 172.16.44.162? Tell 172.16.45.232"
"359","34.806149","Apple_d2:dd:99","Broadcast","ARP","56","Who has 172.16.45.40? Tell 172.16.45.232"
"360","34.806157","Apple_d2:dd:99","Broadcast","ARP","56","Who has 172.16.45.137? Tell 172.16.45.232"
"361","35.415966","0.0.0.0","255.255.255.255","DHCP","342","DHCP Request  - Transaction ID 0xdf88c0b8"
"362","35.825084","Apple_d2:dd:99","Broadcast","ARP","56","Who has 172.16.44.238? Tell 172.16.45.232"
"363","36.439745","AzureWaveTec_0b:66:e7","Broadcast","ARP","56","Who has 172.16.44.1? Tell 172.16.44.213"
"364","37.458481","172.16.44.208","8.8.4.4","TCP","55","60581  >  443 [ACK] Seq=1 Ack=1 Win=251 Len=1"
"365","37.465209","8.8.4.4","172.16.44.208","TCP","66","443  >  60581 [ACK] Seq=1 Ack=2 Win=631 Len=0 SLE=1 SRE=2"
"366","38.180564","0.0.0.0","255.255.255.255","DHCP","342","DHCP Request  - Transaction ID 0xdf88c0b8"
"367","38.693241","Intel_bd:d4:09","Broadcast","ARP","56","Who has 172.16.44.1? Tell 172.16.44.131"
"368","39.022281","172.16.44.208","20.195.84.23","TLSv1.2","85","Application Data"
"369","39.027804","20.195.84.23","172.16.44.208","TCP","60","443  >  59618 [ACK] Seq=55 Ack=122 Win=474 Len=0"
"370","39.204950","Apple_d2:dd:99","Broadcast","ARP","56","Who has 172.16.44.1? Tell 172.16.45.232"
"371","39.511680","Apple_d2:dd:99","Broadcast","ARP","56","ARP Announcement for 172.16.45.232"
"372","39.819590","Apple_d2:dd:99","Broadcast","ARP","56","Who has 172.16.44.1? Tell 172.16.45.232"
"373","40.088499","172.16.44.208","104.18.26.90","TCP","55","60579  >  443 [ACK] Seq=1 Ack=1 Win=251 Len=1"
"374","40.093721","104.18.26.90","172.16.44.208","TCP","66","443  >  60579 [ACK] Seq=1 Ack=2 Win=8 Len=0 SLE=1 SRE=2"
"375","40.822161","35.174.127.31","172.16.44.208","TLSv1.2","78","Application Data"
"376","40.822374","172.16.44.208","35.174.127.31","TLSv1.2","82","Application Data"
"377","40.827706","35.174.127.31","172.16.44.208","TCP","60","443  >  59854 [ACK] Seq=553 Ack=509 Win=320 Len=0"
"378","43.779404","116.119.92.163","172.16.44.208","TLSv1.2","93","Application Data"
"379","43.779499","172.16.44.208","116.119.92.163","TCP","54","61233  >  443 [ACK] Seq=1 Ack=40 Win=1021 Len=0"
"380","43.784577","116.119.92.227","172.16.44.208","TLSv1.2","93","Application Data"
"381","43.784577","116.119.92.96","172.16.44.208","TLSv1.2","93","Application Data"
"382","43.784693","172.16.44.208","116.119.92.227","TCP","54","61238  >  443 [ACK] Seq=1 Ack=40 Win=1021 Len=0"
"383","43.784718","172.16.44.208","116.119.92.96","TCP","54","61239  >  443 [ACK] Seq=1 Ack=40 Win=1021 Len=0"
"384","43.791007","116.119.82.160","172.16.44.208","TLSv1.2","93","Application Data"
"385","43.791007","116.119.69.99","172.16.44.208","TLSv1.2","93","Application Data"
"386","43.791007","116.119.107.160","172.16.44.208","TLSv1.2","93","Application Data"
"387","43.791146","172.16.44.208","116.119.82.160","TCP","54","61236  >  443 [ACK] Seq=1 Ack=40 Win=1021 Len=0"
"388","43.791170","172.16.44.208","116.119.69.99","TCP","54","61242  >  443 [ACK] Seq=1 Ack=40 Win=1021 Len=0"
"389","43.791179","172.16.44.208","116.119.107.160","TCP","54","61235  >  443 [ACK] Seq=1 Ack=40 Win=1021 Len=0"
"390","43.798646","116.119.92.36","172.16.44.208","TLSv1.2","93","Application Data"
"391","43.798769","172.16.44.208","116.119.92.36","TCP","54","61237  >  443 [ACK] Seq=1 Ack=40 Win=1021 Len=0"
"392","44.062854","20.195.84.23","172.16.44.208","TLSv1.2","81","Application Data"
"393","44.106101","172.16.44.208","20.195.84.23","TCP","54","59618  >  443 [ACK] Seq=122 Ack=82 Win=253 Len=0"
"394","44.221490","0.0.0.0","255.255.255.255","DHCP","342","DHCP Request  - Transaction ID 0xe304097b"
"395","46.167949","2e:1b:f1:80:1a:6d","Broadcast","ARP","60","Who has 172.16.44.1? Tell 172.16.45.22"
"396","47.614834","172.16.44.208","35.174.127.31","TLSv1.2","294","Application Data"
"397","47.630906","35.174.127.31","172.16.44.208","TCP","60","443  >  59854 [ACK] Seq=553 Ack=749 Win=320 Len=0"
"398","47.880028","35.174.127.31","172.16.44.208","TLSv1.2","317","Application Data"
"399","47.933482","172.16.44.208","35.174.127.31","TCP","54","59854  >  443 [ACK] Seq=749 Ack=816 Win=250 Len=0"
"400","48.779640","116.119.92.163","172.16.44.208","TLSv1.2","78","Application Data"
"401","48.779640","116.119.92.163","172.16.44.208","TCP","60","443  >  61233 [FIN, ACK] Seq=64 Ack=1 Win=123 Len=0"
"402","48.779725","172.16.44.208","116.119.92.163","TCP","54","61233  >  443 [ACK] Seq=1 Ack=65 Win=1021 Len=0"
"403","48.779824","172.16.44.208","116.119.92.163","TCP","54","61233  >  443 [FIN, ACK] Seq=1 Ack=65 Win=1021 Len=0"
"404","48.788754","116.119.92.163","172.16.44.208","TCP","60","443  >  61233 [ACK] Seq=65 Ack=2 Win=123 Len=0"
"405","48.788754","116.119.92.96","172.16.44.208","TCP","60","[TCP Previous segment not captured] 443  >  61239 [FIN, ACK] Seq=64 Ack=1 Win=123 Len=0"
"406","48.788754","116.119.92.96","172.16.44.208","TCP","78","[TCP Out-Of-Order] 443  >  61239 [PSH, ACK] Seq=40 Ack=1 Win=123 Len=24"
"407","48.788799","172.16.44.208","116.119.92.96","TCP","54","[TCP Dup ACK 383#1] 61239  >  443 [ACK] Seq=1 Ack=40 Win=1021 Len=0"
"408","48.788846","172.16.44.208","116.119.92.96","TCP","54","61239  >  443 [ACK] Seq=1 Ack=65 Win=1021 Len=0"
"409","48.788918","172.16.44.208","116.119.92.96","TCP","54","61239  >  443 [FIN, ACK] Seq=1 Ack=65 Win=1021 Len=0"
"410","48.790142","116.119.107.160","172.16.44.208","TCP","60","[TCP Previous segment not captured] 443  >  61235 [FIN, ACK] Seq=64 Ack=1 Win=123 Len=0"
"411","48.790142","116.119.107.160","172.16.44.208","TCP","78","[TCP Out-Of-Order] 443  >  61235 [PSH, ACK] Seq=40 Ack=1 Win=123 Len=24"
"412","48.790142","116.119.69.99","172.16.44.208","TLSv1.2","78","Application Data"
"413","48.790142","116.119.69.99","172.16.44.208","TCP","60","443  >  61242 [FIN, ACK] Seq=64 Ack=1 Win=123 Len=0"
"414","48.790162","172.16.44.208","116.119.107.160","TCP","54","[TCP Dup ACK 389#1] 61235  >  443 [ACK] Seq=1 Ack=40 Win=1021 Len=0"
"415","48.790205","172.16.44.208","116.119.107.160","TCP","54","61235  >  443 [ACK] Seq=1 Ack=65 Win=1021 Len=0"
"416","48.790220","172.16.44.208","116.119.69.99","TCP","54","61242  >  443 [ACK] Seq=1 Ack=65 Win=1021 Len=0"
"417","48.790275","172.16.44.208","116.119.107.160","TCP","54","61235  >  443 [FIN, ACK] Seq=1 Ack=65 Win=1021 Len=0"
"418","48.790275","172.16.44.208","116.119.69.99","TCP","54","61242  >  443 [FIN, ACK] Seq=1 Ack=65 Win=1021 Len=0"
"419","48.795557","116.119.82.160","172.16.44.208","TLSv1.2","78","Application Data"
"420","48.795557","116.119.82.160","172.16.44.208","TCP","60","443  >  61236 [FIN, ACK] Seq=64 Ack=1 Win=123 Len=0"
"421","48.795557","116.119.92.96","172.16.44.208","TCP","60","443  >  61239 [ACK] Seq=65 Ack=2 Win=123 Len=0"
"422","48.795557","116.119.92.227","172.16.44.208","TLSv1.2","78","Application Data"
"423","48.795557","116.119.92.227","172.16.44.208","TCP","60","443  >  61238 [FIN, ACK] Seq=64 Ack=1 Win=123 Len=0"
"424","48.795557","116.119.107.160","172.16.44.208","TCP","60","443  >  61235 [ACK] Seq=65 Ack=2 Win=123 Len=0"
"425","48.795557","116.119.69.99","172.16.44.208","TCP","60","443  >  61242 [ACK] Seq=65 Ack=2 Win=123 Len=0"
"426","48.795658","172.16.44.208","116.119.82.160","TCP","54","61236  >  443 [ACK] Seq=1 Ack=65 Win=1021 Len=0"
"427","48.795685","172.16.44.208","116.119.92.227","TCP","54","61238  >  443 [FIN, ACK] Seq=1 Ack=65 Win=1021 Len=0"
"428","48.795685","172.16.44.208","116.119.82.160","TCP","54","61236  >  443 [FIN, ACK] Seq=1 Ack=65 Win=1021 Len=0"
"429","48.802139","116.119.82.160","172.16.44.208","TCP","60","443  >  61236 [ACK] Seq=65 Ack=2 Win=123 Len=0"
"430","48.802139","116.119.92.227","172.16.44.208","TCP","60","443  >  61238 [ACK] Seq=65 Ack=2 Win=123 Len=0"
"431","48.805280","116.119.92.36","172.16.44.208","TCP","60","[TCP Previous segment not captured] 443  >  61237 [FIN, ACK] Seq=64 Ack=1 Win=123 Len=0"
"432","48.805280","116.119.92.36","172.16.44.208","TCP","78","[TCP Out-Of-Order] 443  >  61237 [PSH, ACK] Seq=40 Ack=1 Win=123 Len=24"
"433","48.805303","172.16.44.208","116.119.92.36","TCP","54","[TCP Dup ACK 391#1] 61237  >  443 [ACK] Seq=1 Ack=40 Win=1021 Len=0"
"434","48.805345","172.16.44.208","116.119.92.36","TCP","54","61237  >  443 [ACK] Seq=1 Ack=65 Win=1021 Len=0"
"435","48.805419","172.16.44.208","116.119.92.36","TCP","54","61237  >  443 [FIN, ACK] Seq=1 Ack=65 Win=1021 Len=0"
"436","48.812408","116.119.92.36","172.16.44.208","TCP","60","443  >  61237 [ACK] Seq=65 Ack=2 Win=123 Len=0"
"437","48.922520","172.16.44.208","20.195.84.23","TLSv1.2","82","Application Data"
"438","48.927447","20.195.84.23","172.16.44.208","TCP","60","443  >  59618 [ACK] Seq=82 Ack=150 Win=474 Len=0"
"439","49.240039","Intel_55:b4:6e","Broadcast","ARP","56","Who has 172.16.44.1? Tell 172.16.45.79"
"440","49.444760","Intel_80:92:10","Broadcast","ARP","56","Who has 172.16.44.1? Tell 172.16.45.118"
"441","53.810291","157.240.192.55","172.16.44.208","SSL","889","Continuation Data"
"442","53.821915","172.16.44.208","157.240.192.55","SSL","121","Continuation Data"
"443","53.828415","157.240.192.55","172.16.44.208","TCP","60","443  >  60332 [ACK] Seq=2335 Ack=295 Win=5153 Len=0"
"444","53.910483","172.16.44.208","116.119.92.36","TCP","66","61318  >  443 [SYN] Seq=0 Win=65535 Len=0 MSS=1460 WS=256 SACK_PERM"
"445","53.917230","116.119.92.36","172.16.44.208","TCP","66","443  >  61318 [SYN, ACK] Seq=0 Ack=1 Win=32016 Len=0 MSS=1392 SACK_PERM WS=256"
"446","53.917392","172.16.44.208","116.119.92.36","TCP","54","61318  >  443 [ACK] Seq=1 Ack=1 Win=262144 Len=0"
"447","53.920001","172.16.44.208","116.119.92.36","TLSv1.3","725","Client Hello (SNI=media.fmaa1-1.fna.whatsapp.net)"
"448","53.925180","116.119.92.36","172.16.44.208","TCP","60","443  >  61318 [ACK] Seq=1 Ack=672 Win=31488 Len=0"
"449","53.927051","116.119.92.36","172.16.44.208","TLSv1.3","266","Server Hello, Change Cipher Spec, Application Data"
"450","53.927095","172.16.44.208","116.119.92.36","TCP","54","61318  >  443 [ACK] Seq=672 Ack=213 Win=261888 Len=0"
"451","53.933057","172.16.44.208","116.119.92.36","TLSv1.3","118","Change Cipher Spec, Application Data"
"452","53.933221","172.16.44.208","116.119.92.36","TLSv1.3","134","Application Data"
"453","53.936054","172.16.44.208","116.119.92.36","TLSv1.3","328","Application Data"
"454","53.938287","116.119.92.36","172.16.44.208","TCP","60","443  >  61318 [ACK] Seq=213 Ack=816 Win=31488 Len=0"
"455","53.938287","116.119.92.36","172.16.44.208","TLSv1.3","237","Application Data"
"456","53.938339","172.16.44.208","116.119.92.36","TCP","54","61318  >  443 [ACK] Seq=1090 Ack=396 Win=261632 Len=0"
"457","53.943193","116.119.92.36","172.16.44.208","TLSv1.3","159","Application Data, Application Data"
"458","53.943237","172.16.44.208","116.119.92.36","TCP","54","61318  >  443 [ACK] Seq=1090 Ack=501 Win=261632 Len=0"
"459","53.943319","172.16.44.208","116.119.92.36","TLSv1.3","85","Application Data"
"460","53.950776","116.119.92.36","172.16.44.208","TLSv1.3","89","Application Data"
"461","53.950810","172.16.44.208","116.119.92.36","TCP","54","61318  >  443 [ACK] Seq=1121 Ack=536 Win=261376 Len=0"
"462","53.984387","116.119.92.36","172.16.44.208","TCP","60","443  >  61318 [ACK] Seq=536 Ack=1121 Win=31232 Len=0"
"463","54.259085","8a:46:ed:93:d9:64","Broadcast","ARP","42","Who has 172.16.44.1? Tell 172.16.44.151"
"464","54.269804","116.119.92.36","172.16.44.208","TLSv1.3","500","Application Data"
"465","54.269804","116.119.92.36","172.16.44.208","TCP","1514","443  >  61318 [ACK] Seq=982 Ack=1121 Win=31232 Len=1460 [TCP PDU reassembled in 466]"
"466","54.269804","116.119.92.36","172.16.44.208","TLSv1.3","1514","Application Data"
"467","54.269804","116.119.92.36","172.16.44.208","TLSv1.3","1514","Application Data"
"468","54.269804","116.119.92.36","172.16.44.208","TLSv1.3","1514","Application Data"
"469","54.269804","116.119.92.36","172.16.44.208","TLSv1.3","1514","Application Data"
"470","54.269804","116.119.92.36","172.16.44.208","TLSv1.3","1514","Application Data"
"471","54.269804","116.119.92.36","172.16.44.208","TLSv1.3","4434","Application Data, Application Data"
"472","54.269913","172.16.44.208","116.119.92.36","TCP","54","61318  >  443 [ACK] Seq=1121 Ack=14122 Win=262144 Len=0"
"473","54.274492","116.119.92.36","172.16.44.208","TLSv1.3","14654","Application Data, Application Data, Application Data, Application Data, Application Data, Application Data, Application Data"
"474","54.274557","172.16.44.208","116.119.92.36","TCP","54","61318  >  443 [ACK] Seq=1121 Ack=28722 Win=262144 Len=0"
"475","54.281316","116.119.92.36","172.16.44.208","TLSv1.3","8814","Application Data, Application Data, Application Data, Application Data"
"476","54.281316","116.119.92.36","172.16.44.208","TLSv1.3","1514","Application Data"
"477","54.281316","116.119.92.36","172.16.44.208","TLSv1.3","1514","Application Data"
"478","54.281316","116.119.92.36","172.16.44.208","TLSv1.3","2974","Application Data"
"479","54.281404","172.16.44.208","116.119.92.36","TCP","54","61318  >  443 [ACK] Seq=1121 Ack=43322 Win=262144 Len=0"
"480","54.287535","116.119.92.36","172.16.44.208","TLSv1.3","14654","Application Data, Application Data, Application Data, Application Data, Application Data, Application Data"
"481","54.287602","172.16.44.208","116.119.92.36","TCP","54","61318  >  443 [ACK] Seq=1121 Ack=57922 Win=262144 Len=0"
"482","54.292147","116.119.92.36","172.16.44.208","TLSv1.3","14654","Application Data, Application Data, Application Data, Application Data, Application Data, Application Data, Application Data, Application Data"
"483","54.292195","172.16.44.208","116.119.92.36","TCP","54","61318  >  443 [ACK] Seq=1121 Ack=72522 Win=262144 Len=0"
"484","54.297020","116.119.92.36","172.16.44.208","TLSv1.3","2974","Application Data"
"485","54.297020","116.119.92.36","172.16.44.208","TCP","1514","443  >  61318 [ACK] Seq=75442 Ack=1121 Win=31232 Len=1460 [TCP PDU reassembled in 487]"
"486","54.297020","116.119.92.36","172.16.44.208","TCP","1514","443  >  61318 [ACK] Seq=76902 Ack=1121 Win=31232 Len=1460 [TCP PDU reassembled in 487]"
"487","54.297020","116.119.92.36","172.16.44.208","TLSv1.3","1514","Application Data"
"488","54.297020","116.119.92.36","172.16.44.208","TLSv1.3","1514","Application Data"
"489","54.297020","116.119.92.36","172.16.44.208","TCP","1514","443  >  61318 [ACK] Seq=81282 Ack=1121 Win=31232 Len=1460 [TCP PDU reassembled in 490]"
"490","54.297020","116.119.92.36","172.16.44.208","TLSv1.3","1514","Application Data"
"491","54.297020","116.119.92.36","172.16.44.208","TLSv1.3","2974","Application Data"
"492","54.297141","172.16.44.208","116.119.92.36","TCP","54","61318  >  443 [ACK] Seq=1121 Ack=87122 Win=262144 Len=0"
"493","54.302126","116.119.92.36","172.16.44.208","TLSv1.3","14654","Application Data, Application Data, Application Data, Application Data, Application Data, Application Data, Application Data, Application Data"
"494","54.302170","172.16.44.208","116.119.92.36","TCP","54","61318  >  443 [ACK] Seq=1121 Ack=101722 Win=262144 Len=0"
"495","54.307892","116.119.92.36","172.16.44.208","TCP","1514","443  >  61318 [ACK] Seq=101722 Ack=1121 Win=31232 Len=1460 [TCP PDU reassembled in 496]"
"496","54.307892","116.119.92.36","172.16.44.208","TLSv1.3","1475","Application Data, Application Data, Application Data"
"497","54.307921","172.16.44.208","116.119.92.36","TCP","54","61318  >  443 [ACK] Seq=1121 Ack=104603 Win=262144 Len=0"
"498","55.013795","172.16.44.208","20.195.84.23","TLSv1.2","85","Application Data"
"499","55.018909","20.195.84.23","172.16.44.208","TCP","60","443  >  59618 [ACK] Seq=82 Ack=181 Win=474 Len=0"
"500","55.076975","0.0.0.0","255.255.255.255","DHCP","342","DHCP Request  - Transaction ID 0xe304097c"
"501","55.077028","ea:10:74:2a:ed:fd","Broadcast","ARP","42","ARP Announcement for 172.16.44.65"
"502","55.691601","02:d1:ea:6e:7f:95","Broadcast","ARP","60","Who has 172.16.44.1? Tell 172.16.44.253"
"503","56.400471","140.82.114.22","172.16.44.208","TLSv1.2","93","Application Data"
"504","56.400471","140.82.114.22","172.16.44.208","TLSv1.2","78","Application Data"
"505","56.400598","172.16.44.208","140.82.114.22","TCP","54","61186  >  443 [ACK] Seq=2 Ack=65 Win=255 Len=0"
"506","56.400808","172.16.44.208","140.82.114.22","TCP","54","61186  >  443 [FIN, ACK] Seq=2 Ack=65 Win=255 Len=0"
"507","56.408130","ea:10:74:2a:ed:fd","Broadcast","ARP","42","ARP Announcement for 172.16.44.65"
"508","56.418704","140.82.114.22","172.16.44.208","TCP","60","443  >  61186 [ACK] Seq=65 Ack=3 Win=116 Len=0"
"509","56.510044","Apple_d2:dd:99","Broadcast","ARP","56","Who has 172.16.44.147? Tell 172.16.45.232"
"510","56.920529","Intel_df:5d:5e","Broadcast","ARP","56","Who has 172.16.44.1? Tell 172.16.44.172"
"511","58.250650","Intel_78:e2:ae","Broadcast","ARP","56","Who has 172.16.44.1? Tell 172.16.46.70"
"512","58.353587","Intel_78:e2:ae","Broadcast","ARP","56","Who has 172.16.40.5? Tell 172.16.46.70"
"513","59.802241","172.16.44.208","140.82.114.25","TCP","55","[TCP Keep-Alive] 61032  >  443 [ACK] Seq=29 Ack=26 Win=254 Len=1"
"514","59.808556","140.82.114.25","172.16.44.208","TCP","66","[TCP Keep-Alive ACK] 443  >  61032 [ACK] Seq=26 Ack=30 Win=62 Len=0 SLE=29 SRE=30"
"515","59.889527","Intel_80:92:10","Broadcast","ARP","56","Who has 172.16.44.1? Tell 172.16.45.118"
"516","60.072080","20.195.84.23","172.16.44.208","TLSv1.2","81","Application Data"
"517","60.120037","172.16.44.208","20.195.84.23","TCP","54","59618  >  443 [ACK] Seq=181 Ack=109 Win=253 Len=0"
"518","61.016919","02:d1:ea:6e:7f:95","Broadcast","ARP","60","Who has 172.16.44.1? Tell 172.16.44.253"
"519","61.323349","02:d1:ea:6e:7f:95","Broadcast","ARP","60","Who has 172.16.44.1? Tell 172.16.44.253"
"520","61.519724","172.16.44.208","40.99.34.242","TCP","54","61296  >  443 [RST, ACK] Seq=2810 Ack=2847 Win=0 Len=0"
"521","61.519961","172.16.44.208","52.182.143.213","TCP","54","61298  >  443 [RST, ACK] Seq=3764 Ack=6986 Win=0 Len=0"
"522","62.142474","Intel_df:5d:5e","Broadcast","ARP","56","Who has 172.16.44.1? Tell 172.16.44.172"
"523","63.166611","de:70:47:dd:bc:20","Broadcast","ARP","56","Who has 172.16.45.219? Tell 172.16.45.40"
"524","63.601577","172.16.44.208","35.174.127.31","TLSv1.2","294","Application Data"
"525","63.606697","35.174.127.31","172.16.44.208","TCP","60","443  >  59854 [ACK] Seq=816 Ack=989 Win=320 Len=0"
"526","63.865998","35.174.127.31","172.16.44.208","TLSv1.2","317","Application Data"
"527","63.921214","172.16.44.208","35.174.127.31","TCP","54","59854  >  443 [ACK] Seq=989 Ack=1079 Win=255 Len=0"
"528","64.605372","Intel_4d:ce:75","Broadcast","ARP","42","Who has 172.16.44.1? Tell 172.16.45.196"
"529","64.701599","de:70:47:dd:bc:20","Broadcast","ARP","56","Who has 172.16.44.238? Tell 172.16.45.40"
"530","65.112277","Intel_80:92:10","Broadcast","ARP","56","Who has 172.16.44.1? Tell 172.16.45.118"
"531","67.672077","Intel_4e:1e:34","Broadcast","ARP","56","Who has 172.16.44.1? Tell 172.16.45.172"
"532","68.150184","116.119.208.225","172.16.44.208","TLSv1.2","93","Application Data"
"533","68.150295","172.16.44.208","116.119.208.225","TCP","54","61240  >  443 [ACK] Seq=1 Ack=40 Win=1023 Len=0"
"534","68.900454","Cisco_0f:22:64","Broadcast","ARP","60","Who has 172.16.45.227? Tell 172.16.44.1"
"535","69.207974","CloudNetwork_b7:4a:c5","Broadcast","ARP","56","Who has 172.16.44.1? Tell 172.16.45.167"
"536","69.514933","CloudNetwork_b7:4a:c5","Broadcast","ARP","56","Who has 172.16.44.1? Tell 172.16.45.167"
"537","69.618775","CloudNetwork_b7:4a:c5","Broadcast","ARP","56","Who has 172.16.44.1? Tell 172.16.45.167"
"538","69.720477","CloudNetwork_b7:4a:c5","Broadcast","ARP","56","Who has 172.16.44.1? Tell 172.16.45.167"
"539","70.014899","172.16.44.208","20.195.84.23","TLSv1.2","85","Application Data"
"540","70.020613","20.195.84.23","172.16.44.208","TCP","60","443  >  59618 [ACK] Seq=109 Ack=212 Win=474 Len=0"
"541","70.232236","0.0.0.0","255.255.255.255","DHCP","364","DHCP Request  - Transaction ID 0xdfb003b5"
"542","70.232297","CloudNetwork_b7:4a:c5","Broadcast","ARP","56","Who has 172.16.44.1? Tell 172.16.45.167"
"543","70.232308","CloudNetwork_b7:4a:c5","Broadcast","ARP","56","Who has 172.16.44.1? Tell 172.16.45.167"
"544","70.334107","Intel_80:92:10","Broadcast","ARP","56","Who has 172.16.44.1? Tell 172.16.45.118"
"545","70.436564","CloudNetwork_b7:4a:c5","Broadcast","ARP","56","Who has 172.16.44.1? Tell 172.16.45.167"
"546","70.436599","CloudNetwork_b7:4a:c5","Broadcast","ARP","56","Who has 172.16.44.1? Tell 172.16.45.167"
"547","70.538393","0.0.0.0","255.255.255.255","DHCP","342","DHCP Inform   - Transaction ID 0x6a5f467d"
"548","71.164824","157.240.192.55","172.16.44.208","SSL","306","Continuation Data"
"549","71.171794","172.16.44.208","157.240.192.55","SSL","100","Continuation Data"
"550","71.178924","157.240.192.55","172.16.44.208","TCP","60","443  >  60332 [ACK] Seq=2587 Ack=341 Win=5153 Len=0"
"551","71.272070","172.16.44.208","104.21.16.1","TCP","55","[TCP Keep-Alive] 60582  >  443 [ACK] Seq=1 Ack=1 Win=255 Len=1"
"552","71.276453","104.21.16.1","172.16.44.208","TCP","66","[TCP Keep-Alive ACK] 443  >  60582 [ACK] Seq=1 Ack=2 Win=20 Len=0 SLE=1 SRE=2"
"553","71.563117","0.0.0.0","255.255.255.255","DHCP","364","DHCP Request  - Transaction ID 0x6cf68200"
"554","71.869894","CloudNetwork_b7:4a:c5","Broadcast","ARP","56","Who has 172.16.45.167? (ARP Probe)"
"555","71.869926","Cisco_0f:22:64","Broadcast","ARP","60","Who has 172.16.45.227? Tell 172.16.44.1"
"556","71.972738","CloudNetwork_b7:4a:c5","Broadcast","ARP","56","Who has 172.16.45.167? (ARP Probe)"
"557","72.279425","Intel_d4:7c:2c","Broadcast","ARP","56","Who has 172.16.44.1? Tell 172.16.44.250"
"558","72.483966","fe80::bd14:a805:ca4:20d6","ff02::1","ICMPv6","86","Neighbor Advertisement fe80::bd14:a805:ca4:20d6 (ovr) is at 10:b1:df:b7:4a:c5"
"559","72.587127","Intel_d4:7c:2c","Broadcast","ARP","56","Who has 172.16.44.250? (ARP Probe)"
"560","73.099799","Intel_d4:7c:2c","Broadcast","ARP","56","Who has 172.16.44.1? Tell 172.16.44.250"
"561","73.160574","116.119.208.225","172.16.44.208","TCP","60","[TCP Previous segment not captured] 443  >  61240 [FIN, ACK] Seq=64 Ack=1 Win=123 Len=0"
"562","73.160574","116.119.208.225","172.16.44.208","TCP","78","[TCP Out-Of-Order] 443  >  61240 [PSH, ACK] Seq=40 Ack=1 Win=123 Len=24"
"563","73.160610","172.16.44.208","116.119.208.225","TCP","54","[TCP Dup ACK 533#1] 61240  >  443 [ACK] Seq=1 Ack=40 Win=1023 Len=0"
"564","73.160662","172.16.44.208","116.119.208.225","TCP","54","61240  >  443 [ACK] Seq=1 Ack=65 Win=1023 Len=0"
"565","73.160720","172.16.44.208","116.119.208.225","TCP","54","61240  >  443 [FIN, ACK] Seq=1 Ack=65 Win=1023 Len=0"
"566","73.165400","116.119.208.225","172.16.44.208","TCP","60","443  >  61240 [ACK] Seq=65 Ack=2 Win=123 Len=0"
"567","73.407445","CloudNetwork_b7:4a:c5","Broadcast","ARP","56","Who has 172.16.45.167? (ARP Probe)"
"568","73.508771","Intel_d4:7c:2c","Broadcast","ARP","56","Who has 172.16.44.250? (ARP Probe)"
"569","73.508800","fe80::a18f:7a6:6c44:89fc","ff02::1","ICMPv6","86","Neighbor Advertisement fe80::a18f:7a6:6c44:89fc (ovr) is at 68:7a:64:d4:7c:2c"
"570","73.611209","0.0.0.0","255.255.255.255","DHCP","342","DHCP Request  - Transaction ID 0xf7a306bc"
"571","73.611265","0.0.0.0","255.255.255.255","DHCP","364","DHCP Request  - Transaction ID 0x6cf68200"
"572","74.328742","172.16.44.208","185.199.111.133","TCP","55","[TCP Keep-Alive] 60635  >  443 [ACK] Seq=1 Ack=1 Win=1022 Len=1"
"573","74.333410","185.199.111.133","172.16.44.208","TCP","66","[TCP Keep-Alive ACK] 443  >  60635 [ACK] Seq=1 Ack=2 Win=121 Len=0 SLE=1 SRE=2"
"574","74.533021","Intel_d4:7c:2c","Broadcast","ARP","56","Who has 172.16.44.250? (ARP Probe)"
"575","74.726723","172.16.44.208","185.199.110.133","TCP","55","[TCP Keep-Alive] 61008  >  443 [ACK] Seq=1 Ack=1 Win=251 Len=1"
"576","74.731922","185.199.110.133","172.16.44.208","TCP","66","[TCP Keep-Alive ACK] 443  >  61008 [ACK] Seq=1 Ack=2 Win=125 Len=0 SLE=1 SRE=2"
"577","74.737864","Intel_bd:d4:09","Broadcast","ARP","56","Who has 172.16.44.1? Tell 172.16.44.131"
"578","74.789025","140.82.114.25","172.16.44.208","TLSv1.2","79","Application Data"
"579","74.789298","172.16.44.208","140.82.114.25","TLSv1.2","83","Application Data"
"580","74.794920","140.82.114.25","172.16.44.208","TCP","60","443  >  61032 [ACK] Seq=51 Ack=59 Win=62 Len=0"
"581","74.840944","0.0.0.0","255.255.255.255","DHCP","364","DHCP Request  - Transaction ID 0x970d0654"
"582","74.841001","Intel_d3:e0:cd","Broadcast","ARP","56","Who has 172.16.44.1? Tell 172.16.46.18"
"583","75.046002","172.16.44.208","185.199.110.133","TCP","55","[TCP Keep-Alive] 61009  >  443 [ACK] Seq=1 Ack=1 Win=254 Len=1"
"584","75.061698","185.199.110.133","172.16.44.208","TCP","66","[TCP Keep-Alive ACK] 443  >  61009 [ACK] Seq=1 Ack=2 Win=125 Len=0 SLE=1 SRE=2"
"585","75.147278","Intel_d3:e0:cd","Broadcast","ARP","56","Who has 172.16.46.18? (ARP Probe)"
"586","75.556246","Intel_d4:7c:2c","Broadcast","ARP","56","ARP Announcement for 172.16.44.250"
"587","75.556291","CloudNetwork_b7:4a:c5","Broadcast","ARP","56","ARP Announcement for 172.16.45.167"
"588","75.658738","CloudNetwork_b7:4a:c5","Broadcast","ARP","56","Who has 172.16.44.1? Tell 172.16.45.167"
"589","75.760736","CloudNetwork_b7:4a:c5","Broadcast","ARP","56","Who has 172.16.44.1? Tell 172.16.45.167"
"590","75.760759","CloudNetwork_b7:4a:c5","Broadcast","ARP","56","ARP Announcement for 172.16.45.167"
"591","75.760765","CloudNetwork_b7:4a:c5","Broadcast","ARP","56","Who has 172.16.44.1? Tell 172.16.45.167"
"592","75.863454","0.0.0.0","255.255.255.255","DHCP","364","DHCP Request  - Transaction ID 0x970d0654"
"593","75.863522","Cisco_0f:22:64","Broadcast","ARP","60","Who has 172.16.45.227? Tell 172.16.44.1"
"594","76.047152","20.195.84.23","172.16.44.208","TLSv1.2","81","Application Data"
"595","76.068595","Intel_d3:e0:cd","Broadcast","ARP","56","Who has 172.16.46.18? (ARP Probe)"
"596","76.068622","fe80::2871:3e22:4c2b:910f","ff02::1","ICMPv6","86","Neighbor Advertisement fe80::2871:3e22:4c2b:910f (ovr) is at 3c:e9:f7:d3:e0:cd"
"597","76.096291","172.16.44.208","20.195.84.23","TCP","54","59618  >  443 [ACK] Seq=212 Ack=136 Win=253 Len=0"
"598","77.092773","Intel_d3:e0:cd","Broadcast","ARP","56","Who has 172.16.46.18? (ARP Probe)"
"599","77.604010","Intel_d4:7c:2c","Broadcast","ARP","56","ARP Announcement for 172.16.44.250"
"600","77.604045","0.0.0.0","255.255.255.255","DHCP","340","DHCP Discover - Transaction ID 0xc0bc6e73"
"601","77.604090","0.0.0.0","255.255.255.255","DHCP","350","DHCP Request  - Transaction ID 0xc0bc6e73"
"602","77.707168","0a:32:87:11:ab:69","Broadcast","ARP","56","Who has 172.16.44.1? Tell 172.16.45.132"
"603","78.129237","Intel_d3:e0:cd","Broadcast","ARP","56","ARP Announcement for 172.16.46.18"
"604","78.923950","172.16.44.208","20.195.84.23","TLSv1.2","82","Application Data"
"605","78.929059","20.195.84.23","172.16.44.208","TCP","60","443  >  59618 [ACK] Seq=136 Ack=240 Win=474 Len=0"
"606","79.346143","0.0.0.0","255.255.255.255","DHCP","364","DHCP Request  - Transaction ID 0xdaddbff3"
"607","79.346238","Intel_4f:a6:aa","Broadcast","ARP","56","Who has 172.16.45.11? (ARP Probe)"
"608","79.346252","Intel_4f:a6:aa","Broadcast","ARP","56","Who has 172.16.44.1? Tell 172.16.45.11"
"609","79.346262","be:5b:99:f1:28:23","Broadcast","ARP","56","Who has 172.16.44.1? Tell 172.16.45.47"
"610","79.550585","2e:1b:f1:80:1a:6d","Broadcast","ARP","60","Who has 172.16.44.1? Tell 172.16.45.22"
"611","79.606680","172.16.44.208","35.174.127.31","TLSv1.2","294","Application Data"
"612","79.611579","35.174.127.31","172.16.44.208","TCP","60","443  >  59854 [ACK] Seq=1079 Ack=1229 Win=320 Len=0"
"613","79.890564","35.174.127.31","172.16.44.208","TLSv1.2","318","Application Data"
"614","79.939990","172.16.44.208","35.174.127.31","TCP","54","59854  >  443 [ACK] Seq=1229 Ack=1343 Win=254 Len=0"
"615","80.062175","Intel_d3:e0:cd","Broadcast","ARP","56","ARP Announcement for 172.16.46.18"
"616","80.164792","Intel_4d:ce:75","Broadcast","ARP","42","Who has 172.16.44.1? Tell 172.16.45.196"
"617","80.369266","Intel_4f:a6:aa","Broadcast","ARP","56","Who has 172.16.45.11? (ARP Probe)"
"618","80.369293","fe80::7ee2:6f50:9f2c:7f48","ff02::1","ICMPv6","86","Neighbor Advertisement fe80::7ee2:6f50:9f2c:7f48 (ovr) is at 30:f6:ef:4f:a6:aa"
"619","82.417914","Intel_4f:a6:aa","Broadcast","ARP","56","ARP Announcement for 172.16.45.11"
"620","82.471306","172.16.44.208","8.8.4.4","TCP","55","[TCP Keep-Alive] 60581  >  443 [ACK] Seq=1 Ack=1 Win=251 Len=1"
"621","82.476476","8.8.4.4","172.16.44.208","TCP","66","[TCP Keep-Alive ACK] 443  >  60581 [ACK] Seq=1 Ack=2 Win=631 Len=0 SLE=1 SRE=2"
"622","82.622336","0.0.0.0","255.255.255.255","DHCP","364","DHCP Request  - Transaction ID 0xd525cfd1"
"623","82.622383","Intel_d3:4b:77","Broadcast","ARP","60","Who has 172.16.44.1? Tell 172.16.44.200"
"624","82.732966","157.240.192.55","172.16.44.208","SSL","485","Continuation Data"
"625","82.742073","172.16.44.208","157.240.192.55","SSL","121","Continuation Data"
"626","82.750067","157.240.192.55","172.16.44.208","TCP","60","443  >  60332 [ACK] Seq=3018 Ack=408 Win=5153 Len=0"
"627","82.930209","Intel_d3:4b:77","Broadcast","ARP","60","Who has 172.16.44.200? (ARP Probe)"
"628","83.236749","2e:1b:f1:80:1a:6d","Broadcast","ARP","60","Who has 172.16.44.1? Tell 172.16.45.22"
"629","83.749186","Intel_d3:4b:77","Broadcast","ARP","60","Who has 172.16.44.200? (ARP Probe)"
"630","83.749246","fe80::8e76:2c78:cd2b:eb93","ff02::1","ICMPv6","86","Neighbor Advertisement fe80::8e76:2c78:cd2b:eb93 (ovr) is at d0:65:78:d3:4b:77"
"631","83.889323","157.240.192.55","172.16.44.208","SSL","549","Continuation Data"
"632","83.901001","172.16.44.208","157.240.192.55","SSL","116","Continuation Data"
"633","83.907479","157.240.192.55","172.16.44.208","TCP","60","443  >  60332 [ACK] Seq=3513 Ack=470 Win=5153 Len=0"
"634","83.954037","Cisco_0f:22:64","Broadcast","ARP","60","Who has 172.16.45.227? Tell 172.16.44.1"
"635","84.363178","Intel_4f:a6:aa","Broadcast","ARP","56","ARP Announcement for 172.16.45.11"
"636","84.401989","157.240.192.55","172.16.44.208","SSL","838","Continuation Data"
"637","84.412973","172.16.44.208","157.240.192.55","SSL","116","Continuation Data"
"638","84.419518","157.240.192.55","172.16.44.208","TCP","60","443  >  60332 [ACK] Seq=4297 Ack=532 Win=5153 Len=0"
"639","84.560673","157.240.192.55","172.16.44.208","SSL","838","Continuation Data"
"640","84.565209","172.16.44.208","157.240.192.55","SSL","116","Continuation Data"
"641","84.571364","157.240.192.55","172.16.44.208","TCP","60","443  >  60332 [ACK] Seq=5081 Ack=594 Win=5153 Len=0"
"642","84.773022","Intel_d3:4b:77","Broadcast","ARP","60","Who has 172.16.44.200? (ARP Probe)"
"643","84.786328","157.240.192.55","172.16.44.208","SSL","843","Continuation Data"
"644","84.793641","172.16.44.208","157.240.192.55","SSL","116","Continuation Data"
"645","84.800429","157.240.192.55","172.16.44.208","TCP","60","443  >  60332 [ACK] Seq=5870 Ack=656 Win=5153 Len=0"
"646","85.025824","172.16.44.208","20.195.84.23","TLSv1.2","85","Application Data"
"647","85.030817","20.195.84.23","172.16.44.208","TCP","60","443  >  59618 [ACK] Seq=136 Ack=271 Win=474 Len=0"
"648","85.106172","172.16.44.208","104.18.26.90","TCP","55","[TCP Keep-Alive] 60579  >  443 [ACK] Seq=1 Ack=1 Win=251 Len=1"
"649","85.113032","104.18.26.90","172.16.44.208","TCP","66","[TCP Keep-Alive ACK] 443  >  60579 [ACK] Seq=1 Ack=2 Win=8 Len=0 SLE=1 SRE=2"
"650","85.285032","0.0.0.0","255.255.255.255","DHCP","364","DHCP Request  - Transaction ID 0xdaddbff3"
"651","85.489871","0.0.0.0","255.255.255.255","DHCP","348","DHCP Discover - Transaction ID 0x2c9cbcb1"
"652","85.795983","Intel_d3:4b:77","Broadcast","ARP","60","ARP Announcement for 172.16.44.200"
"653","86.253791","157.240.192.55","172.16.44.208","SSL","356","Continuation Data"
"654","86.262520","172.16.44.208","157.240.192.55","SSL","121","Continuation Data"
"655","86.269324","157.240.192.55","172.16.44.208","TCP","60","443  >  60332 [ACK] Seq=6172 Ack=723 Win=5153 Len=0"
"656","86.410359","0.0.0.0","255.255.255.255","DHCP","348","DHCP Discover - Transaction ID 0x2c9cbcb1"
"657","87.742122","Intel_d3:4b:77","Broadcast","ARP","60","ARP Announcement for 172.16.44.200"
"658","88.357985","0.0.0.0","255.255.255.255","DHCP","348","DHCP Discover - Transaction ID 0x2c9cbcb1"
"659","88.458717","0.0.0.0","255.255.255.255","DHCP","358","DHCP Request  - Transaction ID 0x2c9cbcb1"
"660","88.561351","a2:da:d2:7f:f6:1b","Broadcast","ARP","64","Gratuitous ARP for 172.16.44.163 (Request)"
"661","88.561387","fa:bb:e7:68:34:e0","Broadcast","ARP","60","Who has 172.16.44.1? Tell 172.16.44.179"
"662","90.404898","Intel_4d:ce:75","Broadcast","ARP","42","Who has 172.16.44.1? Tell 172.16.45.196"
"663","90.502164","157.240.192.55","172.16.44.208","SSL","388","Continuation Data"
"664","90.507869","172.16.44.208","157.240.192.55","SSL","121","Continuation Data"
"665","90.514820","157.240.192.55","172.16.44.208","TCP","60","443  >  60332 [ACK] Seq=6506 Ack=790 Win=5153 Len=0"
"666","91.059178","20.195.84.23","172.16.44.208","TLSv1.2","81","Application Data"
"667","91.109397","172.16.44.208","20.195.84.23","TCP","54","59618  >  443 [ACK] Seq=271 Ack=163 Win=253 Len=0"
"668","91.224251","Intel_80:92:10","Broadcast","ARP","56","Who has 172.16.44.1? Tell 172.16.45.118"
"669","94.091582","0.0.0.0","255.255.255.255","DHCP","342","DHCP Request  - Transaction ID 0x4837b77e"
"670","94.091645","Apple_0e:3c:06","Broadcast","ARP","60","ARP Announcement for 172.16.44.170"
"671","94.296252","Apple_0e:3c:06","Broadcast","ARP","60","Who has 172.16.44.1? Tell 172.16.44.170"
"672","95.114521","Apple_0e:3c:06","Broadcast","ARP","60","Who has 172.16.44.1? Tell 172.16.44.170"
"673","95.320297","Intel_bd:d4:09","Broadcast","ARP","56","Who has 172.16.44.1? Tell 172.16.44.131"
"674","95.421628","Apple_0e:3c:06","Broadcast","ARP","60","ARP Announcement for 172.16.44.170"
"675","95.524821","Intel_4d:ce:75","Broadcast","ARP","42","Who has 172.16.44.1? Tell 172.16.45.196"
"676","95.606331","172.16.44.208","35.174.127.31","TLSv1.2","294","Application Data"
"677","95.611318","35.174.127.31","172.16.44.208","TCP","60","443  >  59854 [ACK] Seq=1343 Ack=1469 Win=320 Len=0"
"678","95.833305","Apple_0e:3c:06","Broadcast","ARP","60","Who has 172.16.44.1? Tell 172.16.44.170"
"679","95.871692","35.174.127.31","172.16.44.208","TLSv1.2","318","Application Data"
"680","95.911388","172.16.44.208","35.174.127.31","TCP","54","59854  >  443 [ACK] Seq=1469 Ack=1607 Win=253 Len=0"
"681","96.446585","Intel_80:92:10","Broadcast","ARP","56","Who has 172.16.44.1? Tell 172.16.45.118"
"682","96.856243","0.0.0.0","255.255.255.255","DHCP","356","DHCP Discover - Transaction ID 0xf6db38b9"
"683","97.572891","0.0.0.0","255.255.255.255","DHCP","366","DHCP Request  - Transaction ID 0xf6db38b9"
"684","97.675005","Intel_bd:d4:09","Broadcast","ARP","56","Who has 172.16.44.253? Tell 172.16.44.131"
"685","97.982607","0.0.0.0","255.255.255.255","DHCP","366","DHCP Request  - Transaction ID 0xf6db38b9"
"686","98.495122","Intel_bd:d4:09","Broadcast","ARP","56","Who has 172.16.44.253? Tell 172.16.44.131"
"687","98.578028","172.16.44.208","20.190.146.39","TCP","54","61278  >  443 [FIN, ACK] Seq=1 Ack=1 Win=255 Len=0"
"688","98.578124","172.16.44.208","20.190.146.39","TCP","54","61274  >  443 [FIN, ACK] Seq=1 Ack=1 Win=255 Len=0"
"689","98.582981","20.190.146.39","172.16.44.208","TCP","60","443  >  61278 [FIN, ACK] Seq=1 Ack=2 Win=229 Len=0"
"690","98.582981","20.190.146.39","172.16.44.208","TCP","60","443  >  61274 [FIN, ACK] Seq=1 Ack=2 Win=203 Len=0"
"691","98.583028","172.16.44.208","20.190.146.39","TCP","54","61278  >  443 [ACK] Seq=2 Ack=2 Win=255 Len=0"
"692","98.583063","172.16.44.208","20.190.146.39","TCP","54","61274  >  443 [ACK] Seq=2 Ack=2 Win=255 Len=0"
"693","98.801551","fa:bb:e7:68:34:e0","Broadcast","ARP","60","Who has 172.16.44.1? Tell 172.16.44.179"
"694","99.571641","185.199.110.133","172.16.44.208","TLSv1.2","105","Application Data"
"695","99.571641","185.199.110.133","172.16.44.208","TLSv1.2","78","Application Data"
"696","99.571741","172.16.44.208","185.199.110.133","TCP","54","61008  >  443 [ACK] Seq=2 Ack=77 Win=250 Len=0"
"697","99.571943","172.16.44.208","185.199.110.133","TCP","54","61008  >  443 [FIN, ACK] Seq=2 Ack=77 Win=250 Len=0"
"698","99.577571","185.199.110.133","172.16.44.208","TCP","60","443  >  61008 [ACK] Seq=77 Ack=3 Win=125 Len=0"
"699","99.897298","185.199.110.133","172.16.44.208","TLSv1.2","105","Application Data"
"700","99.897298","185.199.110.133","172.16.44.208","TLSv1.2","78","Application Data"
"701","99.897388","172.16.44.208","185.199.110.133","TCP","54","61009  >  443 [ACK] Seq=2 Ack=77 Win=254 Len=0"
"702","99.897570","172.16.44.208","185.199.110.133","TCP","54","61009  >  443 [FIN, ACK] Seq=2 Ack=77 Win=254 Len=0"
"703","99.903141","185.199.110.133","172.16.44.208","TCP","60","443  >  61009 [ACK] Seq=77 Ack=3 Win=125 Len=0"
"704","99.928537","0.0.0.0","255.255.255.255","DHCP","366","DHCP Request  - Transaction ID 0xf6db38b9"
"705","100.645727","Intel_4d:ce:75","Broadcast","ARP","42","Who has 172.16.44.1? Tell 172.16.45.196"
"706","100.746409","fa:af:ba:7a:48:25","Broadcast","ARP","56","Who has 169.254.169.254? Tell 172.16.45.115"
"707","100.746443","fa:af:ba:7a:48:25","Broadcast","ARP","56","Who has 169.254.169.254? Tell 172.16.45.115"
"708","101.022664","172.16.44.208","20.195.84.23","TLSv1.2","85","Application Data"
"709","101.035997","20.195.84.23","172.16.44.208","TCP","60","443  >  59618 [ACK] Seq=163 Ack=302 Win=474 Len=0"
"710","101.565878","Intel_80:92:10","Broadcast","ARP","56","Who has 172.16.44.1? Tell 172.16.45.118"
"711","102.795201","ce:d1:94:11:6b:ac","Broadcast","ARP","56","Who has 172.16.44.238? Tell 172.16.44.74"
"712","102.795237","ce:d1:94:11:6b:ac","Broadcast","ARP","56","Who has 172.16.45.137? Tell 172.16.44.74"
"713","103.819278","ce:d1:94:11:6b:ac","Broadcast","ARP","56","Who has 172.16.44.238? Tell 172.16.44.74"
"714","103.819323","ce:d1:94:11:6b:ac","Broadcast","ARP","56","Who has 172.16.45.137? Tell 172.16.44.74"
"715","104.331979","ce:d1:94:11:6b:ac","Broadcast","ARP","56","Who has 172.16.44.147? Tell 172.16.44.74"
"716","104.741060","ce:d1:94:11:6b:ac","Broadcast","ARP","56","Who has 172.16.45.137? Tell 172.16.44.74"
"717","104.843482","0.0.0.0","255.255.255.255","DHCP","366","DHCP Request  - Transaction ID 0xf6db38b9"
"718","105.253323","ce:d1:94:11:6b:ac","Broadcast","ARP","56","Who has 172.16.44.147? Tell 172.16.44.74"
"719","105.919198","157.240.192.55","172.16.44.208","SSL","501","Continuation Data"
"720","105.927111","172.16.44.208","157.240.192.55","SSL","121","Continuation Data"
"721","105.934433","157.240.192.55","172.16.44.208","TCP","60","443  >  60332 [ACK] Seq=6953 Ack=857 Win=5153 Len=0"
"722","106.072252","ce:d1:94:11:6b:ac","Broadcast","ARP","56","Who has 172.16.45.162? Tell 172.16.44.74"
"723","106.091388","20.195.84.23","172.16.44.208","TLSv1.2","81","Application Data"
"724","106.140831","172.16.44.208","20.195.84.23","TCP","54","59618  >  443 [ACK] Seq=302 Ack=190 Win=253 Len=0"
"725","106.236910","172.16.44.208","52.187.49.141","TCP","54","61289  >  443 [FIN, ACK] Seq=1 Ack=1 Win=252 Len=0"
"726","106.242092","52.187.49.141","172.16.44.208","TCP","60","443  >  61289 [FIN, ACK] Seq=1 Ack=2 Win=214 Len=0"
"727","106.242164","172.16.44.208","52.187.49.141","TCP","54","61289  >  443 [ACK] Seq=2 Ack=2 Win=252 Len=0"
"728","106.482650","a6:20:9d:b5:7f:1c","Broadcast","ARP","42","Who has 172.16.44.74? Tell 172.16.44.114"
"729","106.482672","8a:46:ed:93:d9:64","Broadcast","ARP","42","Who has 172.16.44.74? Tell 172.16.44.151"
"730","106.482678","Intel_08:13:17","Broadcast","ARP","56","Who has 172.16.44.1? Tell 172.16.44.69"
"731","106.585029","Intel_08:13:17","Broadcast","ARP","56","Who has 172.16.44.1? Tell 172.16.44.69"
"732","106.585068","Intel_08:13:17","Broadcast","ARP","56","Who has 172.16.44.69? (ARP Probe)"
"733","106.686155","0.0.0.0","255.255.255.255","DHCP","364","DHCP Request  - Transaction ID 0x183cdde7"
"734","106.789281","Intel_08:13:17","Broadcast","ARP","56","Who has 172.16.44.1? Tell 172.16.44.69"
"735","107.300770","ce:d1:94:11:6b:ac","Broadcast","ARP","56","Who has 172.16.44.75? Tell 172.16.44.74"
"736","107.428752","157.240.192.55","172.16.44.208","SSL","556","Continuation Data"
"737","107.434735","172.16.44.208","157.240.192.55","SSL","116","Continuation Data"
"738","107.444896","157.240.192.55","172.16.44.208","TCP","60","443  >  60332 [ACK] Seq=7455 Ack=919 Win=5153 Len=0"
"739","107.608008","Intel_08:13:17","Broadcast","ARP","56","Who has 172.16.44.69? (ARP Probe)"
"740","107.733959","157.240.192.55","172.16.44.208","SSL","819","Continuation Data"
"741","107.740917","172.16.44.208","157.240.192.55","SSL","116","Continuation Data"
"742","107.749067","157.240.192.55","172.16.44.208","TCP","60","443  >  60332 [ACK] Seq=8220 Ack=981 Win=5153 Len=0"
"743","107.853510","157.240.192.55","172.16.44.208","SSL","819","Continuation Data"
"744","107.895403","172.16.44.208","157.240.192.55","TCP","54","60332  >  443 [ACK] Seq=981 Ack=8985 Win=511 Len=0"
"745","107.923058","172.16.44.208","157.240.192.55","SSL","116","Continuation Data"
"746","107.929731","157.240.192.55","172.16.44.208","TCP","60","443  >  60332 [ACK] Seq=8985 Ack=1043 Win=5153 Len=0"
"747","108.065309","157.240.192.55","172.16.44.208","SSL","824","Continuation Data"
"748","108.072076","172.16.44.208","157.240.192.55","SSL","116","Continuation Data"
"749","108.079450","157.240.192.55","172.16.44.208","TCP","60","443  >  60332 [ACK] Seq=9755 Ack=1105 Win=5153 Len=0"
"750","108.632126","Intel_08:13:17","Broadcast","ARP","56","Who has 172.16.44.69? (ARP Probe)"
"751","108.928741","172.16.44.208","20.195.84.23","TLSv1.2","82","Application Data"
"752","108.935700","20.195.84.23","172.16.44.208","TCP","60","443  >  59618 [ACK] Seq=190 Ack=330 Win=474 Len=0"
"753","109.656719","Intel_08:13:17","Broadcast","ARP","56","ARP Announcement for 172.16.44.69"
"754","110.885589","fa:af:ba:7a:48:25","Broadcast","ARP","56","Who has 172.16.44.74? Tell 172.16.45.115"
"755","111.602076","Intel_08:13:17","Broadcast","ARP","56","ARP Announcement for 172.16.44.69"
"756","111.610334","172.16.44.208","35.174.127.31","TLSv1.2","294","Application Data"
"757","111.614962","35.174.127.31","172.16.44.208","TCP","60","443  >  59854 [ACK] Seq=1607 Ack=1709 Win=320 Len=0"
"758","111.874866","35.174.127.31","172.16.44.208","TLSv1.2","317","Application Data"
"759","111.928270","172.16.44.208","35.174.127.31","TCP","54","59854  >  443 [ACK] Seq=1709 Ack=1870 Win=252 Len=0"
"760","112.022777","0.0.0.0","255.255.255.255","DHCP","366","DHCP Request  - Transaction ID 0xf6db38b9"
"761","112.022886","172.16.44.208","23.34.81.16","TCP","54","61299  >  443 [FIN, ACK] Seq=2702 Ack=68155 Win=262144 Len=0"
"762","112.027529","23.34.81.16","172.16.44.208","TCP","60","443  >  61299 [FIN, ACK] Seq=68155 Ack=2703 Win=61696 Len=0"
"763","112.027570","172.16.44.208","23.34.81.16","TCP","54","61299  >  443 [ACK] Seq=2703 Ack=68156 Win=262144 Len=0"
"764","114.054845","157.240.192.55","172.16.44.208","SSL","216","Continuation Data"
"765","114.065694","172.16.44.208","157.240.192.55","SSL","100","Continuation Data"
"766","114.072350","157.240.192.55","172.16.44.208","TCP","60","443  >  60332 [ACK] Seq=9917 Ack=1151 Win=5153 Len=0"
"767","115.902674","Intel_bd:d4:09","Broadcast","ARP","56","Who has 172.16.44.1? Tell 172.16.44.131"
"768","116.006873","Intel_4d:ce:75","Broadcast","ARP","42","Who has 172.16.44.1? Tell 172.16.45.196"
"769","116.023008","172.16.44.208","20.195.84.23","TLSv1.2","85","Application Data"
"770","116.027382","20.195.84.23","172.16.44.208","TCP","60","443  >  59618 [ACK] Seq=190 Ack=361 Win=474 Len=0"
"771","116.276656","172.16.44.208","104.21.16.1","TCP","55","[TCP Keep-Alive] 60582  >  443 [ACK] Seq=1 Ack=1 Win=255 Len=1"
"772","116.281480","104.21.16.1","172.16.44.208","TCP","66","[TCP Keep-Alive ACK] 443  >  60582 [ACK] Seq=1 Ack=2 Win=20 Len=0 SLE=1 SRE=2"
"773","119.343887","172.16.44.208","185.199.111.133","TCP","55","[TCP Keep-Alive] 60635  >  443 [ACK] Seq=1 Ack=1 Win=1022 Len=1"
"774","119.348691","185.199.111.133","172.16.44.208","TCP","66","[TCP Keep-Alive ACK] 443  >  60635 [ACK] Seq=1 Ack=2 Win=121 Len=0 SLE=1 SRE=2"
"775","119.803774","172.16.44.208","140.82.114.25","TCP","55","[TCP Keep-Alive] 61032  >  443 [ACK] Seq=58 Ack=51 Win=254 Len=1"
"776","119.809011","140.82.114.25","172.16.44.208","TCP","66","[TCP Keep-Alive ACK] 443  >  61032 [ACK] Seq=51 Ack=59 Win=62 Len=0 SLE=58 SRE=59"
"777","121.123988","Intel_4d:ce:75","Broadcast","ARP","42","Who has 172.16.44.1? Tell 172.16.45.196"
"778","121.124022","Intel_bd:d4:09","Broadcast","ARP","56","Who has 172.16.44.1? Tell 172.16.44.131"
"779","121.855562","172.16.44.208","172.16.1.11","DNS","79","Standard query 0x239e A main.vscode-cdn.net"
"780","121.855738","172.16.44.208","172.16.1.11","DNS","79","Standard query 0xb830 HTTPS main.vscode-cdn.net"
"781","121.880466","172.16.1.11","172.16.44.208","DNS","293","Standard query response 0xb830 HTTPS main.vscode-cdn.net CNAME vscode-cdn.z01.azurefd.net CNAME star-azurefd-prod.trafficmanager.net CNAME shed.dual-low.s-part-0030.t-0009.t-msedge.net CNAME s-part-0030.t-0009.t-msedge.net SOA ns1.t-msedge.net"
"782","121.882836","172.16.1.11","172.16.44.208","DNS","249","Standard query response 0x239e A main.vscode-cdn.net CNAME vscode-cdn.z01.azurefd.net CNAME star-azurefd-prod.trafficmanager.net CNAME shed.dual-low.s-part-0030.t-0009.t-msedge.net CNAME s-part-0030.t-0009.t-msedge.net A 13.107.246.58"
"783","121.883495","172.16.44.208","13.107.246.58","TCP","66","61342  >  443 [SYN] Seq=0 Win=65535 Len=0 MSS=1460 WS=256 SACK_PERM"
"784","121.890966","13.107.246.58","172.16.44.208","TCP","66","443  >  61342 [SYN, ACK] Seq=0 Ack=1 Win=42300 Len=0 MSS=1410 SACK_PERM WS=512"
"785","121.891040","172.16.44.208","13.107.246.58","TCP","54","61342  >  443 [ACK] Seq=1 Ack=1 Win=65280 Len=0"
"786","121.891563","172.16.44.208","13.107.246.58","TCP","1464","61342  >  443 [ACK] Seq=1 Ack=1 Win=65280 Len=1410 [TCP PDU reassembled in 787]"
"787","121.891563","172.16.44.208","13.107.246.58","TLSv1.3","772","Client Hello (SNI=main.vscode-cdn.net)"
"788","121.897189","13.107.246.58","172.16.44.208","TCP","60","443  >  61342 [ACK] Seq=1 Ack=1411 Win=40960 Len=0"
"789","121.897189","13.107.246.58","172.16.44.208","TCP","60","443  >  61342 [ACK] Seq=1 Ack=2129 Win=40448 Len=0"
"790","121.903315","13.107.246.58","172.16.44.208","TLSv1.3","153","Hello Retry Request, Change Cipher Spec"
"791","121.903551","172.16.44.208","13.107.246.58","TLSv1.3","996","Change Cipher Spec, Client Hello (SNI=main.vscode-cdn.net)"
"792","121.913349","13.107.246.58","172.16.44.208","TLSv1.3","335","Server Hello, Application Data, Application Data"
"793","121.913820","172.16.44.208","13.107.246.58","TLSv1.3","128","Application Data"
"794","121.913973","172.16.44.208","13.107.246.58","TLSv1.3","146","Application Data"
"795","121.914155","172.16.44.208","13.107.246.58","TLSv1.3","326","Application Data"
"796","121.919660","13.107.246.58","172.16.44.208","TCP","60","443  >  61342 [ACK] Seq=381 Ack=3509 Win=39936 Len=0"
"797","121.922303","13.107.246.58","172.16.44.208","TLSv1.3","125","Application Data"
"798","121.922303","13.107.246.58","172.16.44.208","TCP","11734","443  >  61342 [ACK] Seq=452 Ack=3509 Win=39936 Len=11680 [TCP PDU reassembled in 802]"
"799","121.922364","172.16.44.208","13.107.246.58","TCP","54","61342  >  443 [ACK] Seq=3509 Ack=12132 Win=65280 Len=0"
"800","121.922516","172.16.44.208","13.107.246.58","TLSv1.3","85","Application Data"
"801","121.928260","13.107.246.58","172.16.44.208","TCP","1514","443  >  61342 [ACK] Seq=12132 Ack=3509 Win=39936 Len=1460 [TCP PDU reassembled in 802]"
"802","121.928260","13.107.246.58","172.16.44.208","TLSv1.3","13194","Application Data"
"803","121.928325","172.16.44.208","13.107.246.58","TCP","54","61342  >  443 [ACK] Seq=3540 Ack=26732 Win=65280 Len=0"
"804","121.933172","13.107.246.58","172.16.44.208","TLSv1.3","14654","Application Data, Application Data"
"805","121.933225","172.16.44.208","13.107.246.58","TCP","54","61342  >  443 [ACK] Seq=3540 Ack=41332 Win=65280 Len=0"
"806","121.937697","13.107.246.58","172.16.44.208","TLSv1.3","10274","Application Data"
"807","121.937697","13.107.246.58","172.16.44.208","TLSv1.3","759","Application Data"
"808","121.937743","172.16.44.208","13.107.246.58","TCP","54","61342  >  443 [ACK] Seq=3540 Ack=52257 Win=65280 Len=0"
"809","122.106887","20.195.84.23","172.16.44.208","TLSv1.2","81","Application Data"
"810","122.155160","172.16.44.208","20.195.84.23","TCP","54","59618  >  443 [ACK] Seq=361 Ack=217 Win=253 Len=0"
"811","122.456507","Intel_80:92:10","Broadcast","ARP","56","Who has 172.16.44.1? Tell 172.16.45.118"
